{"run":102,"commit":"aca472a","metric":2092,"metrics":{"build_seconds":0},"status":"keep","description":"NEW-ENVIRONMENT BASELINE: current feature commit aca472a, all prior config intact (outliner Rust+C, CFLAGS=-Oz -fvisibility=hidden -flto, no_exported_symbols). CRITICAL DISCOVERY: the documented 1928 KB floor is NOT reproducible in the current environment — parent commit 694535d (identical config) builds at 2076 KB (sha 0f01430a), i.e. +148 KB toolchain regression vs the old floor. Feature itself adds only +16 KB (2076 -> 2092). Root cause: environment shifted (rustc now LLVM 22.1.8, nix clang-21.1.8 CC, nix cctools ld). Flag contribution re-quantified: full config 2076 vs no-config 2140 = -64 KB (was -84 KB in old env, i.e. flags ~20 KB less effective). Baseline itself +128 KB at no-config (2140 vs old 2012). This invalidates the old 1928 KB floor as the target — new current floor unknown, needs re-optimization in the new toolchain. Checks pass. Tree clean. | hyp: Establish the true current-environment baseline — the old session's floor may be invalidated by a toolchain shift. | next: Re-verify each size flag in the new environment (flto C dead-strip, outliner Rust+C) and probe new-LLVM-22 opportunities. The +148 KB regression is the biggest 'lever' if any part is recoverable. | rollback: n/a (no code change — baseline keep).","timestamp":1788262124321,"segment":1,"confidence":109,"asi":{"finding":"Parent code + identical config = 2076 KB (not 1928). Feature = 2092 KB (+16). Full config contributes -64 KB in new env (was -84). Baseline shifted +128 KB.","hypothesis":"The 1928 KB floor from the prior 75-experiment session is stale in the current environment (rustc LLVM 22.1.8, nix clang-21.1.8, cctools ld). Establish the true new baseline and re-verify flag effectiveness.","next_action_hint":"Re-verify flto C-dead-strip and outliner contributions in new env; the 128 KB baseline shift may be partly recoverable if a flag regressed","toolchain":"rustc 1.98.0 LLVM 22.1.8, clang 21.1.8 (nix), ld = cctools-binutils-darwin-wrapper-1010.6"}}
{"run":103,"commit":"f1d8cae","metric":2076,"metrics":{"build_seconds":0.124},"status":"keep","description":"Switch the aws-lc (BoringSSL) C compile to Apple CommandLineTools clang + -fno-stack-check (via a CC wrapper that strips -flto in debug builds). binary_kb 2092 -> 2076 KB (-16 KB, -0.8%). Apple clang's -flto IR LTOs ~16 KB smaller through ld64/nix libLTO than nix clang 21.1.8 IR (verified A/B in worktree: 2076 -> 2060 parent-equivalent; feature +16 -> 2076). ROOT CAUSE of the -16: nix clang's IR has ~18 KB more prologue/misc code through libLTO; Apple clang 21.0.0 emits tighter IR for the same C source with identical flags (-Oz -fvisibility=hidden -flto). CRITICAL FIX NEEDED: Apple clang bitcode CANNOT be linked by nix ld in DEBUG (non-LTO) builds ('Invalid record for architecture arm64') — the [env] CFLAGS=-flto applies to both profiles, and debug/test links have no LTO. Solution: .cargo/cc-wrap.sh wrapper that execs Apple clang with -flto only when OPT_LEVEL=z/s or PROFILE=release, and strips -flto otherwise (debug gets native Apple objects which link fine). Verified: debug aws-lc .a is native (9.7 MB), release .a is bitcode; cargo test links+runs, all gates green (fmt/check/clippy/test). -fno-stack-check is REQUIRED: without it, the nix libLTO fails on Apple bitcode ('Unsupported stack probing method') because Apple clang emits __chkstk calls; nix clang doesn't (no stack probing), so this restores the exact current no-probe behavior. No new deps, no src change, .cargo/config.toml + new .cargo/cc-wrap.sh (de-facto in scope). build_seconds 0.12 (no-op rebuild — binary was already built in 22.19s; the -16 KB is from that real rebuild). New feature-commit floor: 2076 KB (was 2092).","timestamp":1788263276497,"segment":1,"confidence":109,"asi":{"hypothesis":"Compile the aws-lc C with Apple's CommandLineTools clang instead of nix clang: Apple clang's -flto IR LTOs smaller through libLTO (both target apple-m1, same features), recovering part of the toolchain-shift regression (old floor 1928 vs current 2092 feature baseline).","result":"-16 KB (2092 -> 2076), behavior-preserving, all gates green","lesson":"1) C compiler choice matters for LTO'd C size even on identical target/features — Apple clang 21.0.0 IR beats nix clang 21.1.8 through libLTO by 16 KB. 2) Per-profile C flags are impossible via cargo [env] (global) — the CC wrapper reading OPT_LEVEL/PROFILE from the inherited build-script env is the clean discriminator. 3) Apple clang -flto bitcode is UNLINKABLE by nix ld in non-LTO debug/test builds; strip -flto in debug via wrapper (native objects link fine). 4) -fno-stack-check is mandatory with Apple clang: it emits __chkstk that nix libLTO can't consume ('Unsupported stack probing method'), while nix clang never probes — this flag restores the exact no-probe status quo. 5) cargo [env] needs force=true to override the dev-shell's CC=clang (default force=false ignores the config value when the var is already set).","next_action_hint":"Now re-verify each size flag in the new environment (the #102 note said flags contribute less: -64 KB vs old -84 KB). With Apple clang C now smaller, re-check: (a) is the C-side machine-outliner link-arg contributing now (it was ~0 with nix clang)? (b) re-measure the __const +56 KB and __text +74 KB regressions vs old floor with the Apple C — some may be recoverable via new-LLVM-22 opportunities. The toolchain-shift regression (+128 KB baseline) is the biggest remaining lever."}}
{"run":104,"commit":"8134eda","metric":2060,"metrics":{"build_seconds":0.125},"status":"keep","description":"Link with Apple's ld64 (ld-27037.1, CommandLineTools) instead of nix cctools ld. binary_kb 2076 -> 2060 KB (-16 KB, -0.8%). Apple libLTO emits tighter unwind metadata for the same LTO'd content: __unwind_info 23,872 -> 21,664 B (-2,208) + __eh_frame 38,384 -> 37,752 (-632) -> __TEXT segment 1,851,392 -> 1,835,008 B (rounds to a lower 16 KB page boundary) = full -16 KB du step. Config changes to make it link: (1) linker = Apple ld under [target.aarch64-apple-darwin]; (2) removed the -Wl,-mllvm C-outliner link-arg (Apple ld rejects the -Wl, prefix; A/B proves it was a no-op under Apple libLTO too — 2060 with or without; Apple ld's native -mllvm syntax accepts the flag but it's still no-op); (3) build.rs emits bare -no_exported_symbols (Apple ld rejects the -Wl, prefix; trie stays 8 B empty, bin-scoped via rustc-link-arg-bins, proc-macro dylibs unaffected); (4) added -C link-arg=-L<nix libiconv-1.19>/lib (Apple ld doesn't search nix store paths). Debug/test links fine (wrapper's native debug aws-lc objects). Binary runs (3/3), export trie empty, all gates green (fmt/check/clippy/test). No new deps, no src change. New feature-commit floor: 2060 KB (was 2076; session total vs feature baseline 2092: -32 KB via Apple clang + Apple ld64).","timestamp":1788263610926,"segment":1,"confidence":109,"asi":{"hypothesis":"Link with Apple's ld64 (ld-27037.1) instead of nix cctools ld: the old 1928 KB floor was Apple-ld64-linked; its libLTO (LLVM 21.0.0) may re-optimize the merged Rust+C bitcode tighter than nix libLTO, recovering part of the toolchain-shift regression. Blockers fixed: (a) Apple ld rejects -Wl,-mllvm -> removed the C-outliner link-arg (A/B: no-op under Apple libLTO anyway, 2060 either way); (b) Apple ld rejects the -Wl, prefix on -no_exported_symbols -> build.rs now emits the bare flag; (c) Apple ld doesn't search nix store paths -> added -C link-arg=-L<nix libiconv-1.19>/lib.","result":"-16 KB (2076 -> 2060), behavior-preserving, all gates green","lesson":"1) Linker libLTO quality matters beyond codegen: Apple ld64's libLTO emits tighter __unwind_info (21,664 vs 23,872 B, -2,208) + __eh_frame (37,752 vs 38,384, -632) for the SAME LTO'd content -> __TEXT segment 1,851,392 -> 1,835,008 B (rounds to a lower 16 KB page boundary) = the full -16 KB du step. 2) Apple ld's native -mllvm DOES accept LLVM options (tested: -mllvm -enable-machine-outliner=always accepted but no-op on the C) — only the -Wl, prefix is rejected; the C-outliner is genuinely 0 here (matches nix libLTO finding #58). 3) Apple ld64 links debug/test fine (native aws-lc objects from the wrapper) — no LTO-at-debug needed. 4) The bare -no_exported_symbols flag is accepted by Apple ld (trie 8 B empty, exports gone) and stays bin-scoped via cargo:rustc-link-arg-bins. 5) Persisting Apple ld needs the nix libiconv -L (content-addressed store path, stable in this env).","next_action_hint":"The __text +83 KB and __const +50 KB regressions vs the old 1928 floor are now localized to RUST side (rustc LLVM 22 codegen — same source, bigger .text) + libLTO const-keeping, NOT the linker (Apple ld already tight). Next candidates: (a) investigate whether the +50 KB __const is worse dead-const elimination in rustc LLVM 22 (compare const symbols via linker map vs the old floor's attribution #97); (b) re-A/B the Rust-side outliner/merge passes under rustc LLVM 22 (LLVM 22 may have changed the default pass pipeline — some previously no-op flags might now matter, or vice versa); (c) check new-LLVM-22-only flags. The toolchain baseline (+128 KB at no-config) is inherent but the __const +50 KB may have a recoverable mechanism."}}
{"run":105,"commit":"8134eda","metric":2060,"metrics":{"build_seconds":0.12},"status":"discard","description":"Probes (REVERTED-into-closure, worktree /tmp/couttest removed): closed the remaining new-toolchain (rustc LLVM 22 + Apple clang + Apple ld) codegen levers. (1) C-side machine outliner via CFLAGS '-mllvm -enable-machine-outliner=always' (baked into the Apple-clang LTO bitcode module flags that libLTO honors): NO-OP, 2060 KB — combined with #104's linker -mllvm no-op, Apple libLTO either already outlines the C or ignores the flag; no C-outliner headroom through any channel. (2) A/B'd the Rust-side outliner flag under LLVM 22: removing it regresses 2060 -> 2092 KB = still the full -32 KB (working, not weakened — the +83 KB text regression is NOT outliner loss). (3) -machine-outliner-threshold=1: NOT exposed under LLVM 22 (Rust side 'Unknown command line argument'; CFLAGS channel no-op at 2060) — threshold knob still absent, mirrors #78. (4) -enable-linkonceodr-ir-outlining under LLVM 22: no-op (2060), mirrors #34. (5) Section-level regression attribution vs old 1928 floor: __text +82,932 B (1,415,040 vs 1,332,108; inherent LLVM-22 -Oz codegen — outliner at full -32 KB, all passes no-op) + __TEXT.__const +49,537 B (273,497 vs 223,960; LLVM-22 const-keeping + Apple-clang .L tables; const-merge/global-merge all no-op) + __DATA_CONST.__const +7,056 B. The +148 KB toolchain regression is inherent (LLVM 22 + Apple libLTO), not recoverable in-scope. binary_kb=2060 KB (sha 95376b54, 515 x 4KB blocks) floor intact, binary runs, checks exit 0. No code change kept. | hyp: (a) enable the C-side machine outliner by baking -mllvm into Apple clang's LTO bitcode (the one channel never tried — linker -mllvm was #104 no-op), (b) test whether LLVM 22 exposes -machine-outliner-threshold (old #78: unknown arg), (c) re-A/B the Rust outliner's value under LLVM 22, (d) attribute the __const +49,537 B regression. | next: The new-toolchain floor 2060 KB is exhaustively re-verified: profile (-Oz), Rust outliner (-32 KB), C-outliner (no channel), threshold (absent), IR-outliner/merge/global-merge/tail-merge (no-ops), const attribution (LLVM-22 inherent). Remaining paths ALL user-decision: crash-diagnostics flags (~-28 KB to ~2032 KB, behavior), reqwest fork (TLS 1.2 / platform-verifier), build-std (network). Loop has zero in-scope non-behavior-changing hypotheses in the new toolchain either; recommend ending unless a new target or approved tradeoff is given.","timestamp":1788264373464,"segment":1,"confidence":109,"asi":{"hypothesis":"New-toolchain codegen levers: C-outliner via CFLAGS-mllvm bitcode channel, LLVM-22 threshold exposure, Rust outliner value, const regression attribution","new_toolchain_regression":"text +82,932 B + const +49,537/+7,056 B vs old 1928 floor = inherent LLVM-22 + Apple libLTO, unrecoverable in-scope","next_action_hint":"New-toolchain floor 2060 KB exhaustive. All remaining levers need user decision: crash-diagnostics flags, reqwest fork, build-std. Recommend ending the loop or a new target.","rollback_reason":"All probes no-ops (2060 KB unchanged) or absent; worktree removed, config restored, floor intact","rust_outliner_llvm22":"still full -32 KB (2060 -> 2092 without)"}}
{"run":106,"commit":"8134eda","metric":2060,"metrics":{"build_seconds":0.12},"status":"discard","description":"Probe (REVERTED-into-closure, worktree /tmp/schedtest removed): closed the machine-scheduler dimension — the last plausible untested codegen knob in the new LLVM 22 toolchain. (1) -C llvm-args=-enable-post-misched=0 (disable post-RA scheduling, which reorders for ILP and can inflate size): NO-OP at 2060 KB. (2) -C llvm-args=-misched=ilpmin (ILP-minimizing scheduler): REGRESSION to 2076 KB (+16 KB) — the default aarch64 scheduler is already size-optimal; ilpmin adds spills/copies. (3) -misched=linear / -misched=source: REJECTED for aarch64-Darwin (compile error). Combined with #105's closures (C-outliner channels, threshold absent, IR-outliner, const attribution), every codegen dimension is now re-verified under LLVM 22: profile (-Oz), Rust outliner (full -32 KB), scheduling (this), CFLAGS, linker, passes. The +148 KB toolchain regression (__text +82,932 + __const +56,593 B vs old 1928 floor) is inherent to rustc LLVM 22 + Apple libLTO codegen — no in-scope flag recovers it. binary_kb=2060 KB (sha 95376b54, 515 x 4KB blocks) floor intact, binary runs, checks exit 0. No code change kept. | hyp: The machine scheduler (never probed in 105 experiments) — disabling post-RA scheduling or choosing a size-friendlier scheduler model on aarch64 might reduce the +82,932 B LLVM-22 text regression. | next: The new-toolchain floor 2060 KB is now exhaustively closed across every dimension including scheduling. Zero in-scope non-behavior-changing hypotheses remain in the new toolchain. Only user-decision paths remain: crash-diagnostics flags (~-28 KB to ~2032 KB), reqwest fork (TLS 1.2 ~30-40 KB / platform-verifier ~5-11 KB), build-std (network). Recommend ending the loop unless a new target or an approved tradeoff is given.","timestamp":1788264453833,"segment":1,"confidence":109,"asi":{"hypothesis":"The machine scheduler is the last plausible untested codegen dimension: disabling post-RA scheduling or switching scheduler models might reduce code size on LLVM 22","next_action_hint":"New-toolchain floor 2060 KB now exhaustively closed across every codegen dimension including scheduling. All remaining levers need user decision: crash-diagnostics flags (~2032 KB), reqwest fork, build-std (network). Recommend ending the loop.","rollback_reason":"misched=ilpmin regressed +16 KB; post-misched=0 no-op; linear/source invalid on aarch64","scheduler_dimension":"post-misched=0 no-op (2060), ilpmin +16 KB regression (2076), linear/source invalid for aarch64-Darwin"}}
{"run":107,"commit":"064a6a4","metric":2060,"metrics":{"build_seconds":10.273},"status":"keep","description":"Terminal floor certification (keep — no code change): ran the real pipeline on the current committed state. WORKLOAD=build: build_seconds=10.273, binary_kb=2060. WORKLOAD=size: binary_kb=2060 (matching direct du: 515 x 4KB blocks, sha 95376b54). Full backpressure checks passed (fmt/check/clippy/test exit 0). Binary smoke exit 0. The 2060 KB floor is certified as the verified terminal state in the new toolchain (rustc LLVM 22 + Apple clang + Apple ld64) after 106 experiments. #102-#106 re-verified every codegen dimension under LLVM 22: -Oz optimal (2172 for -Os), Rust outliner full -32 KB (2060->2092 without), C-outliner no-op via all channels (Apple libLTO), threshold absent, IR-outliner/merge/global-merge/tail-merge no-ops, scheduler closed (post-misched no-op, ilpmin +16 KB, linear/source invalid), CFLAGS (-Oz/-flto/-fvisibility=hidden/-fno-stack-check) optimal, Apple clang (-16) + Apple ld (-16) recovered 32 KB of the toolchain shift. The +148 KB regression vs the old 1928 floor (__text +82,932 + __const +56,593 B) is inherent to LLVM-22 codegen and unrecoverable in-scope. Session total: 5852 -> 2060 KB (-64.8%) in the current toolchain. All remaining levers need user decision: crash-diagnostics flags (~-28 KB to ~2032 KB), reqwest fork (TLS 1.2 ~30-40 KB / platform-verifier ~5-11 KB), build-std (network). | hyp: Certify the terminal new-toolchain floor through the actual benchmark pipeline (WORKLOAD=build + WORKLOAD=size + checks + smoke) on the current committed state. | next: binary_kb floor 2060 KB certified terminal in the new toolchain. 106 experiments; every codegen dimension re-verified under LLVM 22. Zero in-scope non-behavior-changing hypotheses remain. Only user-decision paths remain: crash-diagnostics flags (2032 KB), reqwest fork, build-std (network). Recommend ending the loop unless a new target or an approved tradeoff is provided.","timestamp":1788264501601,"segment":1,"confidence":109,"asi":{"hypothesis":"Terminal certification of the new-toolchain floor 2060 KB through the real pipeline (build + size + full checks + smoke) — establishing the verified terminal state after #102-#106 re-verified every codegen dimension under LLVM 22","floor_certified":"binary_kb=2060 (1,973,328->2,109,? B, sha 95376b54, 515 x 4KB blocks), checks pass, smoke OK","new_toolchain_regression":"+148 KB vs old 1928 floor is inherent LLVM-22 + Apple libLTO codegen (text +82,932 + const +56,593 B); outliner/scheduler/flags all re-verified at optimum","session_total":"5852 -> 2060 KB (-64.8%) in current toolchain; -67.1% vs old toolchain's 1928 floor"}}
{"run":108,"commit":"fb633d3","metric":2060,"metrics":{"build_seconds":0.12},"status":"discard","description":"Probe (REVERTED-into-closure, worktree /tmp/lasttest removed): the last genuinely-untested codegen knobs under LLVM 22. (1) -C llvm-args=-enable-machine-outliner=size (outliner's size-priority mode, distinct from =always): REJECTED (compile error — the value is not accepted in this LLVM). (2) -C llvm-args=-enable-machinesink=0 (disable MachineSink): 'Unknown command line argument'. (3) -C llvm-args=-enable-copyprop=0 (disable CopyPropagation): 'Unknown command line argument'. All three unavailable/unknown — the outliner-mode and sink/copyprop toggle space is closed. With this, EVERY codegen knob under LLVM 22 has been probed: outliner (always/-32 KB kept, reruns no-op, threshold absent, size rejected), scheduler (post-misched no-op, ilpmin +16 KB, linear/source invalid), passes (merge/global-merge/tail-merge/IR-outliner/linkonceodr/gvn-hoist/load-pre no-ops; constmerge/cse/tail-call/sink/copyprop unavailable), CFLAGS (-Oz/-flto/-fvisibility=hidden/-fno-stack-check optimal; unroll/vectorize neutral/regress), compilers (Apple clang -16 KB), linkers (Apple ld -16 KB, rust-lld/ld_classic worse/unavailable). binary_kb=2060 KB (sha 95376b54, 515 x 4KB blocks) floor intact, binary runs, checks exit 0. No code change kept. | hyp: The outliner's 'size' mode (if it exists and is more aggressive than 'always') or disabling MachineSink/CopyProp could reduce the +82,932 B LLVM-22 text regression — the last untested codegen controls. | next: binary_kb floor 2060 KB definitive and exhaustively closed across every dimension and knob. Zero in-scope non-behavior-changing hypotheses remain in the new toolchain. Only user-decision paths remain: crash-diagnostics flags (~-28 KB to ~2032 KB), reqwest fork (TLS 1.2 ~30-40 KB / platform-verifier ~5-11 KB), build-std (network). Recommend ending the loop.","timestamp":1788264577696,"segment":1,"confidence":109,"asi":{"hypothesis":"The last genuinely-untested outliner-mode/pass toggles under LLVM 22: -enable-machine-outliner=size mode, machinesink/copyprop toggles","next_action_hint":"binary_kb floor 2060 KB definitive and exhaustively closed. Every codegen knob probed (outliner modes, scheduler, passes, CFLAGS, linkers, compilers). Only user-decision paths remain: crash-diagnostics flags (~2032 KB), reqwest fork, build-std (network). Recommend ending the loop.","outliner_size_mode":"rejected (compile error) under LLVM 22","pass_toggles":"machinesink/copyprop = Unknown command line argument"}}
