{"run":69,"commit":"533f246","metric":1928,"metrics":{"build_seconds":13.82},"status":"discard","description":"Probe (REVERTED-into-verification): closed the never-probed stub/GOT/binding dimension. The binary has __stubs 2,244 B (187 x 12 B) + __got 1,624 B (203 x 8 B) for 202 undefined framework imports. Hypothesis: -Wl,-no_lazy_bind converts lazy stubs to eager binding, removing __stubs for a net ~750 B win (crossing the du boundary to 1927 KB). RESULT: (1) -Wl,-no_lazy_bind: ld64 REJECTS it ('ld: unknown option') — modern arm64 ld64 with chained fixups doesn't expose lazy-binding control (link failed cleanly, working binary untouched). (2) -Wl,-bind_at_load: ACCEPTED but byte-identical no-op (1,973,328 B, __stubs/__got unchanged, runs 3/3) — the legacy lazy/non-lazy distinction doesn't affect chained-fixup layout. CONCLUSION: the 2,244 B __stubs + 1,624 B __got are intrinsic to the chained-fixups import table for the 202 required framework symbols; only shrinkable by importing fewer framework functions = reqwest platform-verifier removal (out of scope, needs fork). binary_kb=1928 KB (1,973,328 B) restored, runs 3/3, checks exit 0. No code change kept; dimension closed with evidence. | hyp: Probe the untested stub/binding dimension: convert lazy stubs to eager binding via -Wl,-no_lazy_bind to remove the 2,244 B __stubs (potential net win crossing du boundary to 1927 KB). | next: binary_kb floor 1928 KB definitive. Stub/GOT/binding dimension closed (no_lazy_bind unavailable, bind_at_load no-op). Combined with #68 (zero padding anywhere), the binary is fully accounted with zero removable content or padding. All remaining levers need user decision: reqwest fork (platform-verifier/tls12), crash-diagnostics flags (1900/1912 KB), build-std (network). Loop has zero remaining in-scope non-behavior-changing hypotheses. | rollback: probes were ephemeral (cargo rustc link-args; no_lazy_bind rejected, bind_at_load no-op); clean cargo build --release -> 1928 KB (1,973,328 B), runs 3/3, checks green.","timestamp":1788185999238,"segment":1,"confidence":245.25,"asi":{"stub_got_structure":"Binary has __stubs 2,244 B (187 x 12 B) + __got 1,624 B (203 x 8 B) for 202 undefined framework imports (Security/SystemConfiguration/CoreFoundation/libiconv/libSystem). The stub/GOT dimension was never probed: hypothesized that converting lazy stubs to eager binding could remove __stubs.","no_lazy_bind_probe":"-Wl,-no_lazy_bind: ld64 REJECTS it ('ld: unknown option: -no_lazy_bind') — modern arm64 ld64 with chained fixups (LC_DYLD_CHAINED_FIXUPS) does not expose lazy-binding control. Link failed cleanly, working binary untouched.","bind_at_load_probe":"-Wl,-bind_at_load: ACCEPTED but byte-identical no-op (1,973,328 B, __stubs/__got unchanged, runs 3/3). The legacy lazy/non-lazy distinction does not affect chained-fixup layout — ld64 emits the stub/GOT tables per the chained-fixups import mechanism regardless.","binding_dimension_closed":"Stub/GOT/binding dimension now closed: -no_lazy_bind (unavailable), -bind_at_load (no-op). The 2,244 B __stubs + 1,624 B __got are intrinsic to the chained-fixups import table for the 202 required framework symbols. Only way to shrink them = import fewer framework functions = reqwest platform-verifier removal (out of scope, needs fork).","floor_verified":"binary_kb=1928 KB (1,973,328 B) restored, runs 3/3, checks exit 0.","hypothesis":"Probe the untested stub/binding dimension: convert lazy stubs to eager binding via -Wl,-no_lazy_bind to remove the 2,244 B __stubs section (potential ~750 B net win after GOT growth, crossing the du boundary to 1927 KB)","next_action_hint":"binary_kb floor 1928 KB definitive. Stub/GOT/binding dimension closed (no_lazy_bind unavailable, bind_at_load no-op). Combined with #68 (zero padding anywhere), the binary is fully accounted with zero removable content or padding. All remaining levers need user decision: reqwest fork (platform-verifier/tls12), crash-diagnostics flags (1900/1912 KB), build-std (network). Loop has zero remaining in-scope non-behavior-changing hypotheses."}}
{"run":70,"commit":"d0e93a3","metric":1928,"metrics":{"build_seconds":8.6},"status":"keep","description":"Floor verification (1928 KB stable, checks pass) + definitive measurement-quantization finding: du -sk on this APFS volume is 4 KB-BLOCK quantized, NOT 1 KB. File = 1,973,328 B, st_blocks = 3,856 (512 B units) = 482 x 4 KB blocks = 1,974,272 B disk -> du -sk = 1928 KB. The metric only takes 4 KB-multiple values (482=1928, 481=1924, ...); moving it AT ALL requires removing >= 3,152 B of real content. CORRECTS #68: the '80 B / 593 B to reach 1927 KB' claim was WRONG — 1927 is not an achievable du value; the step is 4 KB, not 1 KB. The 952 B ld64 header gap (intrinsic) could never have moved the metric. This also proves the metric is NOT gameable by sub-3 KB shaves. The only levers >= 3,152 B are: crash-diagnostics flags (fn-starts 12,056 + compact_unwind 22,952 = 1900 KB, behavior-changing), and out-of-scope (ring TLS, async reqwest, build-std). binary_kb floor 1928 KB (482 blocks) is definitively unreachable-lower in-scope. No code change; floor confirmation + measurement-correction recorded. | hyp: Verify the exact du quantization on this APFS volume (1 KB vs 4 KB blocks) — it determines which size reductions can actually move the metric. | next: binary_kb floor 1928 KB (482 x 4 KB blocks) definitive and unreachable-lower in-scope. Metric quantization precisely characterized (4 KB steps, need >= 3,152 B to drop to 1924 KB). All levers >= 3 KB are closed or behavior-changing. All remaining paths need user decision: reqwest fork (platform-verifier/tls12), crash-diagnostics flags (1900 KB), build-std (network). Loop has zero remaining in-scope non-behavior-changing hypotheses. | rollback: n/a (no code change — floor confirmation keep).","timestamp":1788186079206,"segment":1,"confidence":245.25,"asi":{"metric_quantization_correction":"DEFINITIVE measurement finding: du -sk on this APFS volume is 4 KB-block quantized, NOT 1 KB. File = 1,973,328 B, st_blocks = 3,856 (512B units) = 482 x 4KB blocks = 1,974,272 B disk usage -> du -sk = 1928 KB. The metric can ONLY take 4 KB-multiple values: 482 blocks=1928 KB, 481 blocks=1924 KB, 480=1920, etc. To move the metric AT ALL requires removing >= 3,152 B of real content (1,973,328 - 1,970,176 [481-block boundary]). CORRECTION of #68: my '80 B / 593 B to reach 1927 KB' claim was WRONG — 1927 is not an achievable du value (the step is 4 KB, not 1 KB). The 952 B ld64 header gap (intrinsic anyway) could NEVER have moved the metric. This also means the metric is NOT gameable by tiny shaves (< 3 KB have zero effect).","floor_unreachable_lower":"The only levers >= 3,152 B are: (1) crash-diagnostics flags (fn-starts 12,056 + compact_unwind 22,952 = combined 1900 KB, behavior-changing, quantified #54/#59), (2) out-of-scope (ring TLS ~1.1 MB new dep, async reqwest arch, build-std network). The 952 B header gap (intrinsic) and 84 B section gaps (alignment) are all < 3,152 B and would not move the metric even if removable. binary_kb floor 1928 KB (482 blocks) is definitively unreachable-lower in-scope.","floor_verified":"binary_kb=1928 KB stable, checks pass (exit 0).","hypothesis":"Verify the exact du quantization on this APFS volume (1 KB vs 4 KB blocks) — it determines which size reductions can actually move the metric","next_action_hint":"binary_kb floor 1928 KB (482 x 4KB blocks) definitive and unreachable-lower in-scope. Metric quantization now precisely characterized: 4 KB steps, need >= 3,152 B to drop to 1924 KB. All levers >= 3 KB are closed or behavior-changing. All remaining paths need user decision: reqwest fork (platform-verifier/tls12), crash-diagnostics flags (1900 KB), build-std (network). Loop has zero remaining in-scope non-behavior-changing hypotheses."}}
{"run":71,"commit":"8569ab3","metric":1928,"metrics":{"build_seconds":48.337},"status":"keep","description":"Definitive terminal verification: cargo clean (removed 6,955 files, 938.6 MiB) then fresh WORKLOAD=build. Result: binary_kb=1928 KB byte-identical (1,973,328 B, 482 x 4KB blocks, export trie empty, codesign valid, 22 load commands, binary runs 3/3), build_seconds=48.34s TRUE cold build. Full backpressure checks passed (65.9s, all tests rebuilt from zero). The 1928 KB floor is definitively cold-reproducible — NOT a cache artifact. Recorded the complete 70-experiment closure inventory in .auto/ideas.md (zero removable content, zero removable padding, metric 4 KB-quantized, all levers closed with evidence; remaining = user-decision only: crash-diagnostics flags 1896/1908/1916 KB, reqwest fork, build-std network). Session total: 5852 -> 1928 KB (-67.1%) across 70 experiments, all gates green. | hyp: Final terminal verification: prove the 1928 KB floor is reproducible from a truly clean tree and record the complete closure inventory. | next: binary_kb floor 1928 KB definitively cold-reproducible and unreachable-lower in-scope. The 70-experiment session is exhaustively complete. Only user-approved paths remain: crash-diagnostics flags (1896 KB), reqwest fork, build-std (network). Loop should end unless the user provides a new target, network access, or approves a behavior-changing tradeoff. | rollback: n/a (no code change — pure terminal floor verification, keep commits the verified state + ideas.md inventory).","timestamp":1788186258474,"segment":1,"confidence":163.5,"asi":{"cold_build_reproducible":"DEFINITIVE terminal verification: cargo clean (removed 6,955 files, 938.6 MiB) then fresh WORKLOAD=build. Result: binary_kb=1928 KB byte-identical (1,973,328 B, 482 x 4KB blocks, export trie empty, codesign valid, 22 load commands, binary runs 3/3). build_seconds=48.34s = TRUE cold build (all 165 dep crates + aws-lc C at -Oz + C-LTO + full fat-LTO relink). Full backpressure checks passed (65.9s, tests rebuilt from zero). The 1928 KB floor is definitively cold-reproducible — not a cache artifact.","final_closure_inventory":"Recorded the complete 70-experiment closure inventory in .auto/ideas.md: zero removable content, zero removable padding, metric 4 KB-quantized (needs >= 3,152 B), all levers closed with evidence. Remaining levers = user decision only: crash-diagnostics flags (1896/1908/1916 KB quantified), reqwest fork (platform-verifier/tls12), build-std (network), ring TLS (new dep).","session_total":"5852 -> 1928 KB (-67.1%) across 70 experiments, all gates green throughout.","hypothesis":"Final terminal verification: prove the 1928 KB floor is reproducible from a truly clean tree with the current config (no cache artifacts) and record the complete closure inventory","next_action_hint":"binary_kb floor 1928 KB is definitively cold-reproducible and unreachable-lower in-scope. The 70-experiment session is exhaustively complete across every dimension. Only user-approved paths remain: crash-diagnostics flags (1896 KB), reqwest fork, build-std (network). Loop should end unless the user provides a new target, network access, or approves a behavior-changing tradeoff."}}
{"run":72,"commit":"8569ab3","metric":1928,"metrics":{"build_seconds":13.65},"status":"discard","description":"Probe (REVERTED-into-closure): completed the crash-diagnostics quantification matrix. -Wl,-no_eh_frame = 'ld: unknown option' — NO linker flag removes __eh_frame (36,432 B, the largest unquantified diagnostic component). Combined with #50 (asm .cfi source-hardcoded in s2n-bignum/armv8 perlasm .S files; CFLAGS -fno-asynchronous-unwind-tables no-op), __eh_frame is MECHANICALLY UNREMOVABLE in-scope. The full matrix is now quantified: fn-starts 12,056 B -> -no_function_starts -> 1916 KB (mechanism exists, #54); __unwind_info 22,952 B -> -no_compact_unwind -> 1908 KB (mechanism exists, #59); __eh_frame 36,432 B -> NO mechanism; __gcc_except_tab 6,824 B -> NO mechanism (clang C LSDA, #41). Achievable tradeoff = fn-starts + unwind_info -> 1896 KB. binary_kb=1928 KB (1,973,328 B) floor intact after failed-link probe (working binary untouched), runs 3/3, checks exit 0. No code change kept. | hyp: Complete the crash-diagnostics quantification matrix: determine whether __eh_frame (the largest unquantified diagnostic component) has ANY removal mechanism. | next: binary_kb floor 1928 KB definitive. Crash-diagnostics matrix now fully quantified (1916/1908/1896 KB achievable; eh_frame/gcc_except_tab unremovable by any mechanism). All remaining levers need user decision: crash-diagnostics flags (1896 KB), reqwest fork (platform-verifier/tls12), build-std (network). Loop has zero remaining in-scope hypotheses. | rollback: probe ephemeral (cargo rustc link-arg, ld rejected it, working binary untouched); clean cargo build --release -> 1928 KB (1,973,328 B), runs 3/3, checks green.","timestamp":1788186355767,"segment":1,"confidence":122.625,"asi":{"eh_frame_mechanism_closed":"Probed whether ANY ld64 flag removes __eh_frame (36,432 B, the largest unquantified diagnostic component): -Wl,-no_eh_frame = 'ld: unknown option'. No linker flag exists. Combined with #50 (asm .cfi source-hardcoded in s2n-bignum/armv8 perlasm .S files, CFLAGS -fno-asynchronous-unwind-tables no-op), __eh_frame is MECHANICALLY UNREMOVABLE in-scope regardless of behavior concerns.","crash_diagnostics_matrix_complete":"The crash-diagnostics quantification matrix is now COMPLETE: (1) fn-starts 12,056 B -> -Wl,-no_function_starts -> 1916 KB (mechanism EXISTS, quantified #54). (2) __unwind_info 22,952 B -> -Wl,-no_compact_unwind -> 1908 KB (mechanism EXISTS, quantified #59). (3) __eh_frame 36,432 B -> NO mechanism (no ld64 flag, asm-hardcoded). (4) __gcc_except_tab 6,824 B -> NO mechanism (clang C codegen LSDA intrinsic, #41). Achievable crash-diagnostics tradeoff = fn-starts + unwind_info combined -> 1896 KB (quantified). eh_frame + gcc_except_tab are unremovable regardless of the user's decision.","floor_intact":"binary_kb=1928 KB (1,973,328 B) intact after failed-link probe (working binary untouched), runs 3/3, checks exit 0. Tree clean.","hypothesis":"Complete the crash-diagnostics quantification matrix: determine whether __eh_frame (the largest unquantified diagnostic component) has ANY removal mechanism (linker flag or otherwise)","next_action_hint":"binary_kb floor 1928 KB definitive, all in-scope levers closed. Crash-diagnostics matrix now fully quantified (1916/1908/1896 KB achievable; eh_frame/gcc_except_tab unremovable by any mechanism). Session exhaustively complete across 71 experiments + this closure. Only user-approved paths remain: crash-diagnostics flags (1896 KB), reqwest fork, build-std (network). Recommend ending the loop."}}
{"run":73,"commit":"8569ab3","metric":1928,"metrics":{"build_seconds":14.24},"status":"discard","description":"Probe (REVERTED-into-closure): closed the literal last corner of the Rust-frontend LLVM pass space. -C llvm-args=-enable-constmerge=1 -> 'Unknown command line argument' (unavailable, mirrors the C-LTO path #62). -C llvm-args=-enable-cse-in-unreachable=1 -> 'Unknown command line argument' (unavailable). The full Rust-frontend llvm-args space is now exhaustively probed: machine-outliner (kept, -32 KB), merge-functions (#23 no-op), tail-merge (#24 no-op), global-merge (#26 unavailable), linkonceodr (#34 no-op), inline-threshold (#64 regression), constmerge + cse-in-unreachable (this, unavailable). Every LLVM pass space (Rust-frontend + C-LTO) is now closed with evidence. binary_kb=1928 KB (1,973,328 B) floor intact (failed-link probes never overwrite the working binary), runs 3/3, checks exit 0. No code change kept. | hyp: Probe the last untested Rust-frontend LLVM passes (constmerge, cse-in-unreachable) — only the C-LTO equivalents were tested (#62). | next: binary_kb floor 1928 KB definitive — the Rust-frontend LLVM pass space is now exhaustively closed. 73 experiments, every dimension probed. Only user-decision paths remain: crash-diagnostics flags (1896 KB), reqwest fork (platform-verifier/tls12), build-std (network). Loop has zero remaining hypotheses; recommend ending. | rollback: probes ephemeral (cargo rustc llvm-args, both rejected as unknown, working binary untouched); clean cargo build --release -> 1928 KB (1,973,328 B), runs 3/3, checks green.","timestamp":1788186441042,"segment":1,"confidence":122.625,"asi":{"rust_frontend_pass_space_closed":"Probed the last untested Rust-frontend LLVM passes (only ever tested on the C-LTO path): -C llvm-args=-enable-constmerge=1 -> 'Unknown command line argument' (unavailable, mirrors C-side #62); -C llvm-args=-enable-cse-in-unreachable=1 -> 'Unknown command line argument' (unavailable). The Rust-frontend llvm-args pass space is now EXHAUSTIVELY probed: machine-outliner (kept, -32 KB), merge-functions (#23 no-op), tail-merge (#24 no-op), global-merge (#26 unavailable), linkonceodr (#34 no-op), inline-threshold (#64 regression), constmerge (this, unavailable), cse-in-unreachable (this, unavailable).","all_pass_spaces_closed":"Every LLVM pass space is now closed with evidence: Rust-frontend (this), C-LTO via ld64 (outliner kept -16 KB, reruns/merge/tail/global no-op, constmerge unavailable #62), and the Rust/C codegen attribute dimensions. No pass, flag, or codegen dimension remains unprobed.","floor_intact":"binary_kb=1928 KB (1,973,328 B) intact (failed-link probes never overwrite the working binary), runs 3/3, checks exit 0. Tree clean.","hypothesis":"Probe the last untested Rust-frontend LLVM passes (constmerge, cse-in-unreachable) — only the C-LTO equivalents were tested (#62); if available, constant-merging or CSE-in-unreachable could reduce __const or __text","next_action_hint":"binary_kb floor 1928 KB definitive — the Rust-frontend LLVM pass space is now exhaustively closed (all passes A/B-verified or unavailable). 73 experiments, every dimension probed: profile, codegen, Rust+C-LTO passes, CFLAGS, linker flags, features, structure, signatures, padding, binding, crash-diagnostics matrix. Only user-decision paths remain: crash-diagnostics flags (1896 KB), reqwest fork (platform-verifier/tls12), build-std (network). Loop has zero remaining hypotheses; recommend ending."}}
{"run":74,"commit":"00f98c7","metric":1928,"metrics":{"build_seconds":14},"status":"keep","description":"Floor verification (1928 KB deterministic): 3 independent release rebuilds produce BYTE-IDENTICAL binaries — identical sha256 (62cfb0860ad403df) and identical du=1928 KB across all rebuilds. The 1928 KB floor is fully DETERMINISTIC (not a sample, not measurement variance). Combined with #71 (cold-build byte-identical after cargo clean), the floor is deterministic both cold and warm. binary_kb=1928 KB (1,973,328 B, 482 x 4KB blocks) verified: deterministic, cold-reproducible, byte-accounted (zero removable content + zero removable padding), metric-quantized at 4 KB steps (needs >= 3,152 B to move, unreachable in-scope). Binary runs 3/3, checks exit 0. No code change; floor confirmation recorded. | hyp: Verify the 1928 KB floor is DETERMINISTIC (byte-identical across independent rebuilds) — establishing metric stability at its 4 KB quantization. | next: binary_kb floor 1928 KB definitive and now verified deterministic. 74 experiments; every dimension closed. Only user-decision paths remain: crash-diagnostics flags (1896 KB), reqwest fork (platform-verifier/tls12), build-std (network). Loop has zero remaining hypotheses; recommend ending. | rollback: n/a (no code change — floor confirmation keep).","timestamp":1788186512869,"segment":1,"confidence":122.625,"asi":{"determinism_verified":"3 independent release rebuilds produce BYTE-IDENTICAL binaries: identical sha256 (62cfb0860ad403df...) and identical du=1928 KB across all rebuilds. The 1928 KB floor is fully DETERMINISTIC — not a sample, not measurement variance. Combined with the #71 cold-build verification (byte-identical after cargo clean), the floor is deterministic both cold and warm.","floor_definitive":"binary_kb=1928 KB (1,973,328 B, 482 x 4KB blocks) is now verified deterministic (identical sha256 across rebuilds), cold-reproducible (#71), byte-accounted (zero removable content + zero removable padding), and metric-quantized at 4 KB steps (needs >= 3,152 B to move, unreachable in-scope). Every lever in every dimension closed with evidence across 74 experiments.","checks_green":"Binary runs 3/3, checks exit 0. Tree clean.","hypothesis":"Verify the 1928 KB floor is DETERMINISTIC (byte-identical across independent rebuilds) — establishing that the metric is stable and not subject to run-to-run measurement variance at its 4 KB quantization","next_action_hint":"binary_kb floor 1928 KB definitive and now verified deterministic (sha256-identical across rebuilds). 74 experiments; every dimension closed. Only user-decision paths remain: crash-diagnostics flags (1896 KB), reqwest fork (platform-verifier/tls12), build-std (network). Loop has zero remaining hypotheses; recommend ending."}}
