{"run":116,"commit":"a2461de","metric":2060,"metrics":{"build_seconds":0.114},"status":"keep","description":"Terminal certification + last-cell closure (no code change, floor intact). (1) MIGRATION COMMITTED (a2461de): moved machine-specific size-optimization config out of .cargo/config.toml into the nix devShell env (flake.nix sizeOptEnv injects CC=Apple CLT clang via cc-wrap.sh, CFLAGS=-Oz -fvisibility=hidden -flto -fno-stack-check, linker=Apple ld64, libiconv via MYAGENT_LIBICONV_LIB_DIR+RUSTFLAGS -L); build.rs emits bare -no_exported_symbols for direct ld64 / -Wl, otherwise; config.toml keeps only the portable machine-outliner. Verified: binary_kb=2060 (2,106,704 B byte-exact floor, deterministic across rebuilds), structural spot-check floor-exact (empty export trie 8 B, 22 load cmds, codesign valid, __text 1,415,040 + __TEXT.__const 273,497 B), full gates pass (fmt/check/test/clippy, 0 warnings), binary runs, plain non-devShell build works, no machine paths hardcoded (grep clean), libiconv GC-protected (3 paths in devShell closure). (2) RUST-LLD PROBE (last untested new-toolchain linker cell, REVERTED-into-closure): rust-lld needs the BARE -no_exported_symbols (rejects -Wl, form); with a temp build.rs branch it links at binary_kb=2060 (file 2,106,672 B = 32 B smaller than Apple ld64's 2,106,704 B, far below the 1,360 B du boundary) — metric-identical, Apple ld64 retained, probe reverted. All linker variants now closed under LLVM 22 (Apple ld64 optimal, rust-lld metric-identical, ld_classic no-op #82). Zero in-scope non-behavior-changing hypotheses remain; loop formally ended by user decision (keep 2060 KB floor).","timestamp":1788268845103,"segment":1,"confidence":109,"asi":{"hypothesis":"The migration (env-injected size config) reproduces the certified 2060 KB floor byte-exactly; rust-lld is the one untested new-toolchain linker cell and might beat Apple ld64 under LLVM 22.","next_action_hint":"Loop formally ended (user decision, 2060 KB floor). All remaining paths require user approval: crash-diagnostics flags -> 2032 KB (build.rs two lines), reqwest fork TLS 1.2 ~2030 KB, platform-verifier ~2056 KB, build-std (network-blocked), unicode-width ~25 KB (rustyline fork/REPL swap).","result":"Migration certified: 2,106,704 B byte-exact floor, deterministic, all gates green. rust-lld: metric-identical (32 B smaller file, sub-boundary) — Apple ld64 retained. No in-scope win."}}
