{"run":51,"commit":"bd61337","metric":1988,"metrics":{"build_seconds":25.333},"status":"keep","description":"Hide aws-lc (BoringSSL) C exports via CFLAGS -fvisibility=hidden. DISCOVERY: exp #32 was wrong — the 17,912 B export trie contains ~575 BoringSSL C API exports (aws_lc_0_44_0_AES_encrypt etc.), all dead metadata (nothing external links this executable). -no_exported_symbols broke proc-macro builds (global link flag), but -fvisibility=hidden only touches the aws-lc C compile. Result: export trie 17,912 -> 11,472 B, file 2,041,680 -> 2,035,168 B, binary_kb 1996 -> 1988 KB (-8 KB, first win since #21/#31). Checks passed (fmt/check/clippy/test); release binary smoke-tested and runs (exit 0) — hidden symbols resolve internally, exports only matter for external linking. Config: CFLAGS=\"-Oz -fvisibility=hidden\" in .cargo/config.toml [env]. 575 OPENSSL_EXPORT-marked API symbols remain (BoringSSL explicitly default-visibility) — second-stage lever recorded. | hyp: Most of the 17,912-byte export trie is dead BoringSSL exports; -fvisibility=hidden removes them without breaking internal FFI or proc-macro builds. | next: Override OPENSSL_EXPORT (e.g. -DOPENSSL_EXPORT= or hidden attr) to hide the remaining 575 API exports and shrink trie toward ~40 B (~11 KB more). | rollback: n/a (keep — deterministic improvement, all gates green).","timestamp":1788183071890,"segment":1,"confidence":194.4,"asi":{"discovery":"exp #32's claim that the export trie 'contains only __mh_execute_header' was WRONG — it actually contains ~575 BoringSSL C API exports (aws_lc_0_44_0_*) = 17,912 B of dead metadata (nothing links against this executable). -fvisibility=hidden via CFLAGS (not the global -no_exported_symbols that broke proc-macro builds) hides C symbols while keeping internal FFI resolution working.","finding":"export trie 17,912 -> 11,472 B (-6,440 B); file 2,041,680 -> 2,035,168 B (-6,512 B); binary_kb 1996 -> 1988 (-8 KB, crossed a 4KB allocation boundary). Checks pass; release binary smoke-tested (runs, exit 0). 575 OPENSSL_EXPORT-marked API symbols remain visible (BoringSSL explicitly marks public API default-visibility, overriding the flag) — next lever is OPENSSL_EXPORT override.","hypothesis":"Most of the 17,912-byte export trie is dead BoringSSL exports; -fvisibility=hidden via CFLAGS removes them without breaking internal FFI or proc-macro builds","next_action_hint":"Second-stage lever: redefine OPENSSL_EXPORT to empty/hidden (e.g. CFLAGS -DOPENSSL_EXPORT= or -DOPENSSL_EXPORT='__attribute__((visibility(hidden)))') to hide the remaining ~575 API exports and shrink the trie toward ~40 B (~11 KB more). Verify aws-lc header macro expansion first."}}
{"run":52,"commit":"93b7457","metric":1980,"metrics":{"build_seconds":12.114},"status":"keep","description":"Second-stage export removal: build.rs with cargo:rustc-link-arg-bins=-Wl,-no_exported_symbols (bin-target-scoped). The 575 remaining exports were OPENSSL_EXPORT=__attribute__((visibility('default'))) (aws-lc base.h:100) — explicit default, immune to -fvisibility=hidden; C macro override blocked by unconditional header redefinition. -Wl,-no_exported_symbols (needs -Wl, prefix via cc; raw ld64 flag unrecognized) scoped to the final bin via cargo:rustc-link-arg-bins (proc-macro dylibs unaffected — this is why exp #32's global attempt broke). Result: export trie 11,472 -> 8 B (all 575 gone), file 2,035,168 -> 2,023,648 B, binary_kb 1988 -> 1980 KB (-8 KB). Checks passed (fmt/check/clippy/test); smoke test: binary runs (exit 0); 202 undefined framework imports are imports (unaffected); test harness bin also links the flag and passes. Two-stage total: 1996 -> 1980 KB (-16 KB, -0.8%). Verified via cargo-rustc probe first (no file change), then build.rs reproduces via cargo build. | hyp: Remove the remaining ~575 OPENSSL_EXPORT-marked BoringSSL exports to empty the export trie (dead metadata for an executable). | next: Export trie closed (empty). Re-verify new floor ~1980 KB stable; re-audit __LINKEDIT (function-starts 12,808 B / chained-fixups 4,320 B, both previously judged intrinsic) for any remaining reducible content. | rollback: n/a (deterministic keep, all gates green, binary smoke-tested).","timestamp":1788183295589,"segment":1,"confidence":162,"asi":{"discovery":"The 575 remaining exports were OPENSSL_EXPORT = __attribute__((visibility('default'))) (aws-lc base.h line 100) — explicitly default, immune to -fvisibility=hidden; C-side macro override blocked by the header's unconditional redefinition. The correct lever is -Wl,-no_exported_symbols scoped to the FINAL BIN ONLY: exp #32's failure was the flag leaking globally to proc-macro dylibs; cargo:rustc-link-arg-bins in a build.rs applies only to bin targets. Verified -no_exported_symbols needs the -Wl, prefix via cc (raw ld64 flag unrecognized by clang driver).","finding":"Probe (cargo rustc, no file change): export trie 11,472 -> 8 B (all 575 exports gone); file 2,035,168 -> 2,023,648 B. build.rs (cargo:rustc-link-arg-bins=-Wl,-no_exported_symbols) reproduces via cargo build: binary_kb 1988 -> 1980 KB (-8 KB). Empty-export MH_EXECUTE is valid (runs, exit 0; 202 undefined framework imports are imports not exports, unaffected; tests pass — test harness bin also links the flag). Total two-stage win: 1996 -> 1980 KB (-16 KB).","hypothesis":"Hide/remove the remaining ~575 OPENSSL_EXPORT-marked BoringSSL API exports to shrink the export trie toward zero (dead metadata for an executable)","next_action_hint":"Export trie is now empty (8 B) — the entire exports dimension is closed. Remaining possible levers: (1) strip __mh_execute_header is impossible (dyld-required); (2) code signature now re-hashed over fewer pages. Re-verify binary_kb floor ~1980 KB is the new stable state; consider whether __LINKEDIT function-starts (12,808 B, crash-backtrace) or chained-fixups (4,320 B) have any reducible content. Both were previously judged intrinsic. Next: run a stability re-confirmation + full re-baseline of section accounting on the new tree."}}
{"run":53,"commit":"b9abd3f","metric":1980,"metrics":{"build_seconds":28.755},"status":"keep","description":"Clean-rebuild floor confirmation of the new 1980 KB floor. cargo clean (removed 1,600 MB, 10,408 files) then fresh WORKLOAD=build: binary_kb=1980 KB byte-identical (2,023,648 B, export trie 8 B empty, binary smoke-tests exit 0), build_seconds=28.75s true cold build with the new config (build.rs link-arg-bins + CFLAGS). Full backpressure checks passed (fmt/check/clippy/test, rebuilt from zero). Confirms the #51+#52 export wins are NOT cache artifacts. Final __LINKEDIT accounting: fixups 4,320 + trie 8 + fn-starts 12,808 + symtab 3,248 + indsym 1,560 (390 x 4 B, verified = indirectsymoff 2,002,848 — the apparent 1,560 B gap is required stub/GOT mapping, not padding) + strings 3,384 + codesig 15,856 = 41,184 B. File 2,023,648 = 495 blocks, every byte intrinsic. Two-stage win total this session: 1996 -> 1980 KB (-0.8%). No code change this iteration. | hyp: The 1980 KB floor is reproducible from a clean tree and the true cold build time with the new export config is re-measured. | next: binary_kb floor 1980 KB confirmed clean-reproducible. Remaining levers all out-of-scope/behavior-changing (ring TLS, async reqwest, build-std network, aws-lc algo set, function-starts user-visible, du-boundary metric-gaming). Loop exhausted again at 1980 KB. | rollback: n/a (no code change — pure floor confirmation, keep commits the verified state).","timestamp":1788183515827,"segment":1,"confidence":194.4,"asi":{"confidence":"clean rebuild after cargo clean (1.6 GiB removed) reproduces binary_kb=1980 KB byte-identical (2,023,648 B, trie 8 B, binary runs exit 0) — the two wins are not cache artifacts","discovery":"Final byte accounting of the new floor: __LINKEDIT 41,184 B = chained-fixups 4,320 + exports-trie 8 + function-starts 12,808 + symtab 3,248 + indirect-symtab 1,560 (indirectsymoff=2,002,848, nindirectsyms=390 — the apparent 1,560 B 'gap' is required stub/GOT symbol mapping, NOT padding) + string-table 3,384 + code-signature 15,856. Every byte intrinsic. File 2,023,648 B = 495 blocks, du 1980 KB.","hypothesis":"Confirm the new 1980 KB floor is reproducible from a truly clean tree (not a cache artifact of the two export wins) and re-measure true cold build time","next_action_hint":"binary_kb floor 1980 KB confirmed clean-reproducible (1996 -> 1980 over the two export wins). All remaining levers are out-of-scope or behavior-changing: ring TLS swap (~1.1 MB, new dep), async reqwest (arch), build-std (crates.io blocked), aws-lc algo set (dep-level), LC_FUNCTION_STARTS (12,808 B, crash-report attribution — user-visible, kept), 224-byte du-boundary shave (metric-quantization gaming). Loop exhausted again at 1980 KB."}}
{"run":54,"commit":"b9abd3f","metric":1980,"metrics":{"build_seconds":7.25},"status":"discard","description":"Probe (REVERTED): quantified LC_FUNCTION_STARTS removal. cargo-rustc probe (no file change) with -Wl,-no_function_starts: LC_FUNCTION_STARTS (12,808 B) removed -> file 2,023,648 -> 2,010,736 B, binary_kb 1980 -> 1964 KB (-16 KB). Binary STABLE (5/5 exit 0; the single transient 'exit 1' immediately after link was a file-flush race), codesign valid, header valid (21 cmds). NOT KEPT: function starts is the last crash-diagnostic aid on a fully-stripped binary (no symbol names) — removing it degrades crash-report function attribution (user-visible), same -16 KB tradeoff the finalize review rejected for -no_pie; exp #33's keep decision stands. Restored to 1980 KB floor (rebuild, LC_FUNCTION_STARTS present, binary runs). This was the last >1 KB lever; all remaining levers are out-of-scope/behavior-changing/metric-gaming. Recorded in ideas.md with the decision path (user can approve adding one build.rs line -> 1964 KB via normal flow). | hyp: Quantify the last meaningful binary_kb lever (LC_FUNCTION_STARTS) to document its exact potential for user decision. | next: binary_kb floor 1980 KB fully byte-accounted and exhaustively categorized; loop exhausted (see asi). | rollback: probe was ephemeral (cargo rustc, no file change); restored via cargo build --release -> 1980 KB, tree clean.","timestamp":1788183625249,"segment":1,"confidence":243,"asi":{"behavior_impact":"LC_FUNCTION_STARTS is the last crash-diagnostic aid on a fully-stripped binary (no symbol names remain); removing it degrades crash-report symbolication from function-relative to raw offsets — user-visible, same -16 KB tradeoff magnitude the finalize review rejected for -no_pie (hardening). exp #33's keep decision stands.","probe_method":"cargo rustc --release --bin myagent -- -C link-arg=-Wl,-no_function_starts (no file change). Transient 'exit 1' on first run right after link was a file-flush race — 5/5 subsequent runs exit 0; codesign valid; header 21 cmds (LC_FUNCTION_STARTS absent).","quantified":"LC_FUNCTION_STARTS (12,808 B) removal: file 2,023,648 -> 2,010,736 B, binary_kb 1980 -> 1964 KB (-16 KB). Restored to 1980 KB (floor intact).","hypothesis":"Quantify the last meaningful binary_kb lever (LC_FUNCTION_STARTS, 12,808 B) to document its exact potential for user decision","next_action_hint":"Loop exhausted at binary_kb 1980 KB (fully byte-accounted). All remaining levers categorized: out-of-scope (ring TLS ~1.1 MB, async reqwest, build-std=network, aws-lc algo set), behavior-changing (function-starts -16 KB this probe; eh_frame/unwind_info 60 KB crash-unwinding), metric-gaming (224 B du-block shave). If crash-diagnostic granularity is acceptable, user can approve build.rs line -> 1964 KB via normal flow."}}
{"run":55,"commit":"3c30b4f","metric":1944,"metrics":{"build_seconds":27.055},"status":"keep","description":"C-level LTO via CFLAGS=-flto: aws-lc (BoringSSL) C now compiles to LLVM bitcode; ld64 runs its own link-time LTO on the bitcode objects and dead-strips the C at FUNCTION granularity (the level whole-object dead-strip #18 and -ffunction-sections #49 could never reach — rustc's fat LTO is Rust-only). Result: binary_kb 1980 -> 1944 KB (-36 KB, -1.8%), the biggest single win since the machine outliner (-32 KB, exp #21). __text 1,364,992 -> 1,334,128 B (-30,864 B) PROVES real C code removal (file 2,023,648 -> 1,989,792 B; rest is LINKEDIT/signature shrinkage over fewer functions). build_seconds 27.05 (includes aws-lc C rebuild; link-time LTO adds to cold build — secondary tradeoff). Checks passed (fmt/check/clippy/test). Verified: 5/5 smoke runs exit 0, codesign valid, header valid, export trie still empty (8 B). LTO only removes unreachable functions, so behavior is provably identical (reachable code kept); BoringSSL is LTO-safe. No new deps, no src change, no off-limits files (.cargo/config.toml build config, de-facto in scope from prior keeps). | hyp: Compile aws-lc C with -flto so ld64 link-time LTO dead-strips BoringSSL at function granularity. | next: Probe whether the C-LTO dead-strip is saturated or has more headroom; re-measure true cold build time with -flto; re-verify floor stability. | rollback: n/a (deterministic win, all gates green).","timestamp":1788183819467,"segment":1,"confidence":244.25,"asi":{"biggest_win_since_outliner":"1980 -> 1944 KB (-36 KB, -1.8%), larger than the outliner (-32 KB, exp #21). __text 1,364,992 -> 1,334,128 B (-30,864 B) PROVES real C code was removed, not just metadata (file -33,856 B total; rest is LINKEDIT/signature/fn-starts shrinkage over fewer functions).","mechanism":"C-level LTO: CFLAGS=-flto makes aws-lc compile to LLVM bitcode; rustc's fat LTO is Rust-only, but ld64 runs its OWN link-time LTO on bitcode objects, dead-stripping BoringSSL at FUNCTION granularity — the level whole-object dead-strip (#18) and -ffunction-sections (#49, Mach-O no-op) could never reach. This was the one missing additive lever never A/B-tested.","safety":"LTO only removes UNREACHABLE functions; reachable code is kept, so behavior is provably identical. 5/5 smoke runs exit 0, codesign valid, header valid, export trie still empty, checks pass (fmt/check/clippy/test). BoringSSL is LTO-safe (Google compiles it with LTO in production).","tradeoff":"build_seconds up (27s for the C-rebuild run; link-time LTO adds to cold build). Secondary metric — acceptable for -36 KB primary. Next no-change build should be warm ~8s.","hypothesis":"Compile aws-lc C with -flto (LLVM bitcode) so ld64's link-time LTO dead-strips BoringSSL at function granularity — the C dead-strip level whole-object linking can never reach","next_action_hint":"Probe -flto headroom: is the LTO dead-strip saturated, or do more BoringSSL functions become removable? Also re-measure cold build time with -flto. Re-verify floor stability across rebuilds. Possible follow-ups: thin LTO for build time (if ld64 supports), or combine with a fresh section accounting."}}
{"run":56,"commit":"3c49379","metric":1928,"metrics":{"build_seconds":32.034},"status":"keep","description":"C-code machine outlining via ld64 LTO: with CFLAGS=-flto (#55), the aws-lc C codegen happens inside ld64's link-time LTO, which does NOT enable the machine outliner by default (same as -Oz clang per exp #21). Added -C link-arg=-Wl,-mllvm,-enable-machine-outliner=always to .cargo/config.toml rustflags. Result: binary_kb 1944 -> 1928 KB (-16 KB, -0.8%). __text 1,334,128 -> 1,332,108 B (-2,020 B real code reduction) + __LINKEDIT 41,184 -> 40,016 B (fewer function-start entries, smaller codesig over fewer pages). build_seconds 32.03 (relink with outliner flag slightly slower — secondary). Checks passed (fmt/check/clippy/test; global rustflags link-arg harmless for proc-macro dylibs — the flag only matters for LTO bitcode). Verified: 3/3 smoke exit 0, codesign valid, export trie still empty (8 B). No new deps, no src change. Session total so far: 1996 -> 1928 KB (-3.4%): -fvisibility=hidden (-8) + -no_exported_symbols (-8) + C-flto function dead-strip (-36) + C outliner (-16). | hyp: Pass the machine-outliner flag through ld64's -mllvm to outline the C code that -flto now codegens at link time. | next: Probe C-outliner headroom (reruns); re-measure true cold build time; re-verify floor stability. | rollback: n/a (deterministic, all gates green).","timestamp":1788183984762,"segment":1,"confidence":245.25,"asi":{"c_code_outlining":"With CFLAGS=-flto, the aws-lc C codegen happens inside ld64's link-time LTO, which (like -Oz clang, exp #21) does NOT enable the machine outliner by default. Passing -Wl,-mllvm,-enable-machine-outliner=always to ld64's LTO outlines the surviving C code: binary_kb 1944 -> 1928 (-16 KB). __text 1,334,128 -> 1,332,108 B (-2,020 B) real code reduction; __LINKEDIT 41,184 -> 40,016 B (fewer fn-start entries + smaller codesig over fewer pages).","scope_safety":"Global rustflags link-arg applies to all links (incl. proc-macro dylibs) but is only meaningful for LTO bitcode (which only the bin has) — checks passed (fmt/check/clippy/test, proc-macro builds OK). Verified 3/3 smoke exit 0, codesign valid, export trie still empty (8 B).","sequential_wins":"This session: #51 -fvisibility=hidden (-8), #52 -no_exported_symbols (-8), #55 C-flto function-level dead-strip (-36), #56 C-code machine outlining (-16). Total 1996 -> 1928 KB (-3.4%). The C-side (aws-lc) was a rich vein previously thought closed by object-granularity limits.","hypothesis":"Pass the LLVM machine-outliner flag through ld64's -mllvm to outline the C code (which -flto now codegens at link time)","next_action_hint":"Probe C-outliner headroom (reruns?), then re-measure true cold build time with CFLAGS=-flto + outliner (build_seconds rising: 27 -> 32s warm-relink). Also re-verify floor stability across rebuilds and full clean rebuild."}}
{"run":57,"commit":"39fffe0","metric":1928,"metrics":{"build_seconds":30.326},"status":"keep","description":"Clean-rebuild floor confirmation of the new 1928 KB floor. cargo clean (removed 9,161 files, 1.5 GiB) then fresh WORKLOAD=build: binary_kb=1928 KB byte-identical (1,973,328 B, export trie 8 B empty, codesign valid, 3/3 smoke exit 0), build_seconds=30.33s TRUE cold build with the new config (CFLAGS=-Oz -fvisibility=hidden -flto + outliner link-arg) — only +1.6s vs the pre-flto 28.75s for the -52 KB session total. Full backpressure checks passed (fmt/check/clippy/test, rebuilt from zero). Confirms the #55 (-flto) + #56 (C-outliner) wins are NOT cache artifacts. Also this iteration closed the C-outliner headroom probes: machine-outliner-reruns=10 = no-op (+304 B, saturated as with Rust exp #22), C merge-functions = no-op (identical, as with Rust #23). | hyp: Confirm the 1928 KB floor is reproducible from a clean tree and re-measure true cold build time. | next: binary_kb floor 1928 KB clean-reproducible. C-side now exhaustively optimized (flto function-dead-strip, outliner, reruns, merge-functions all A/B'd). Remaining levers out-of-scope/behavior-changing/metric-gaming (see asi). | rollback: n/a (no code change — pure floor confirmation, keep commits the verified state).","timestamp":1788184131527,"segment":1,"confidence":245.25,"asi":{"cold_build_cost":"True cold build with the new config (CFLAGS=-Oz -fvisibility=hidden -flto + outliner link-arg): build_seconds=30.33s vs 28.75s pre-flto (1980 KB) — only +1.6s (+5.6%) for the -52 KB session total. Link-time LTO parallelizes acceptably on cold build. Warm incremental relink with flag change was 32s (single-threaded).","clean_reproducibility":"cargo clean (removed 9,161 files, 1.5 GiB) then fresh build: binary_kb=1928 KB byte-identical (1,973,328 B, trie 8 B empty, codesign valid, 3/3 smoke exit 0). The -flto + C-outliner wins are NOT cache artifacts.","session_total":"This continuation session: 1996 -> 1928 KB (-68 B... actually -68 KB, -3.4%): #51 fvisibility -8, #52 no_exported_symbols -8, #55 C-flto dead-strip -36, #56 C-outliner -16, floor confirmed #57.","hypothesis":"Confirm the new 1928 KB floor is reproducible from a truly clean tree and re-measure true cold build time with the -flto + outliner config","next_action_hint":"binary_kb floor 1928 KB clean-reproducible, cold build 30.3s. C-side now exhaustively optimized (flto function-dead-strip, outliner, reruns no-op, merge-functions no-op). Remaining levers: out-of-scope (ring TLS, async reqwest, build-std network, aws-lc algo set), behavior-changing (function-starts 1964 KB probe, eh_frame/unwind_info 60 KB), metric-gaming (du-boundary shave). Loop approaching exhaustion at 1928 KB."}}
