{"run":58,"commit":"39fffe0","metric":1928,"metrics":{"build_seconds":8.7},"status":"discard","description":"Probes (REVERTED, no-ops): closed the C-LTO LLVM pass space on the freshly-LTO'd C code. cargo-rustc probes (no file change): -Wl,-mllvm,-enable-tail-merge=1 (1928 KB, no-op — already in -Oz pipeline), -Wl,-mllvm,-global-merge-all-const=1 (1928 KB, no-op — LTO globalopt already merges constants). Also confirmed: aws-lc objects are LLVM bitcode (wrapper format), and clang -Oz sets size-level module flags honored by libLTO (ld64) so the C is at -Oz density (no opt-level headroom). Symtab fully accounted: 1 defined (__mh_execute_header, dyld-required) + 202 undefined imports. Combined with #56's closure of outliner-reruns + merge-functions, the entire C-LTO pass space is now A/B-verified (outliner = the only win, -16 KB). Restored to 1928 KB floor; binary runs. ideas.md updated with the C-LTO discoveries and new floor. | hyp: Probe the last untested C-LTO passes (tail-merge, global-merge) and confirm C opt-level is -Oz. | next: binary_kb floor 1928 KB stands. All remaining levers categorized (out-of-scope / behavior-changing / metric-gaming); only user-approved paths remain. | rollback: probes ephemeral (cargo rustc, no file change), restored via cargo build --release -> 1928 KB.","timestamp":1788184277885,"segment":1,"confidence":245.25,"asi":{"c_opt_level_confirmed":"aws-lc objects confirmed as LLVM bitcode (wrapper format); clang -Oz sets size-level module flags honored by libLTO (ld64) — C code is at -Oz density, no opt-level headroom.","closed_probes":"C-LTO pass space fully closed: machine-outliner-reruns=10 (no-op +304 B), enable-merge-functions (no-op), enable-tail-merge (no-op, in -Oz pipeline), global-merge-all-const (no-op, LTO globalopt merges). All cargo-rustc probes reverted; binary restored 1928 KB.","symtab":"1 defined symbol = __mh_execute_header (dyld-required) + 202 undefined imports — fully accounted, nothing removable.","hypothesis":"Close the C-LTO LLVM pass space (tail-merge, global-merge on the freshly-LTO'd C) and confirm the C opt-level is -Oz (no hidden headroom)","next_action_hint":"binary_kb floor 1928 KB stands, C-side exhaustively optimized. All remaining levers categorized (out-of-scope / behavior-changing / metric-gaming). Re-verifying the same levers adds nothing; only user-approved paths remain: function-starts removal (->1964/1964 KB region), ring TLS, build-std, or a genuinely new dep-level change."}}
{"run":59,"commit":"39fffe0","metric":1928,"metrics":{"build_seconds":9},"status":"discard","description":"Probes (REVERTED, quantified): closed the last >1KB levers with exact numbers for user decision. -Wl,-no_compact_unwind removes __unwind_info (22,952 B): binary_kb 1928 -> 1912 KB (-16 KB), __eh_frame (36,432 B asm .cfi) + __gcc_except_tab unchanged, binary runs (3/3), codesign valid. Combined -no_compact_unwind + -no_function_starts: 1928 -> 1900 KB (-28 KB), file 1,944,704 B, both removed, binary runs (5/5), codesign valid. REVERTED: both degrade crash diagnostics (C-frame unwinding + function-boundary attribution) — same behavior-change category as #54; needs user approval via normal flow. Also documented segment-padding finding: __DATA_CONST (11,608 B) + __DATA (2,424 B) padding is intrinsic arm64 16 KB page alignment, not reclaimable in-scope. Restored to 1928 KB floor; binary runs. ideas.md updated with the exact decision-path numbers (1900/1912/1928). | hyp: Quantify the largest remaining binary_kb levers (__unwind_info, function-starts) for a user decision. | next: binary_kb floor 1928 KB stands. Two user-decision levers quantified (1900 KB crash-diagnostics-off, 1912 KB unwind-only). All others out-of-scope/behavior-changing/metric-gaming. Loop exhausted at 1928 KB unless user approves the tradeoff. | rollback: probes ephemeral (cargo rustc, no file change), restored via cargo build --release -> 1928 KB (1,973,328 B), binary runs.","timestamp":1788184484027,"segment":1,"confidence":245.25,"asi":{"unwind_info_quantified":"-Wl,-no_compact_unwind removes __unwind_info (22,952 B): binary_kb 1928 -> 1912 KB (-16 KB). __eh_frame (36,432 B asm .cfi) + __gcc_except_tab unchanged. Binary runs (3/3), codesign valid.","combined_quantified":"-no_compact_unwind + -no_function_starts: 1928 -> 1900 KB (-28 KB), file 1,944,704 B, both removed, binary runs (5/5), codesign valid. This is the largest remaining lever (all crash-diagnostics-off).","segment_padding":"__DATA_CONST (11,608 B) + __DATA (2,424 B) padding is intrinsic arm64 16 KB page alignment (segments are 16,384-byte multiples; content ends 0x...d12a8, segment forced 0x...d4000). Reclaiming needs ~9 KB __const shrink = crypto tables = dep-level, out of scope. No in-scope padding lever.","revert_reason":"Both levers degrade crash diagnostics (C-frame unwinding via compact table + function-boundary attribution) — same behavior-change category as #54 function-starts precedent. Requires user approval via normal flow; NOT kept in autoresearch. Restored to 1928 KB floor, binary runs.","hypothesis":"Quantify the largest remaining binary_kb levers (__unwind_info removal, function-starts) to give the user exact numbers for a crash-diagnostics tradeoff decision","next_action_hint":"binary_kb floor 1928 KB stands (restored). Two user-decision levers quantified: -no_compact_unwind (-16 KB -> 1912), + -no_function_starts (-28 KB -> 1900 combined). All other levers out-of-scope/behavior-changing/metric-gaming. Loop exhausted at 1928 KB unless user approves crash-diagnostics tradeoff."}}
{"run":60,"commit":"39fffe0","metric":1928,"metrics":{"build_seconds":8.79},"status":"discard","description":"Probe (REVERTED, hypothesis falsified definitively): the last untested non-behavior-changing lever. -Wl,-segalign,0x1000 (4 KB) on arm64: __DATA_CONST vmsize UNCHANGED (0x34000), file 1,973,440 B (+112 B), and the binary is **Killed: 9 (SIGKILL exit 137) at load** — dyld rejects 4 KB segment alignment on Apple Silicon. Definitive proof 16 KB segment alignment is mandatory; the ~14 KB padding (__DATA_CONST 11,608 + __DATA 2,424 B) is intrinsic and cannot be reclaimed. Restored to 1928 KB (1,973,328 B), binary runs 3/3, codesign valid, __unwind_info restored (22,952 B). Tree clean. Every dimension now closed with evidence (profile, Rust LLVM passes, C-LTO passes, CFLAGS, linker flags, features, sections, segment alignment). ideas.md updated. | hyp: Reduce segment-page padding (~14 KB) via -Wl,-segalign,0x1000 — the last untested non-behavior-changing lever. | next: binary_kb floor 1928 KB exhaustively closed across every dimension. Remaining levers ALL categorized: crash-diagnostics tradeoff (1900 KB combined / 1912 KB unwind-only — needs user approval), out-of-scope (ring TLS, async reqwest, build-std network, aws-lc algo set), metric-gaming. Loop exhausted; recommend ending unless user approves a tradeoff or provides a new target. | rollback: probe broken the binary (dyld SIGKILL), restored via cargo build --release -> 1928 KB (1,973,328 B), runs 3/3.","timestamp":1788184542438,"segment":1,"confidence":245.25,"asi":{"segalign_probe":"-Wl,-segalign,0x1000 (4 KB) on arm64: segment vmsize unchanged (0x34000), file +112 B, and the binary is Killed: 9 (SIGKILL exit 137) at load — dyld rejects 4 KB segment alignment on Apple Silicon. Definitive proof 16 KB segment alignment is mandatory; the ~14 KB padding (DATA_CONST 11,608 + DATA 2,424) is intrinsic and NOT reclaimable.","last_lever_closed":"This was the LAST untested non-behavior-changing lever. Every dimension now closed with evidence: profile, Rust LLVM passes, C-LTO passes, CFLAGS, linker flags (exports win, function-starts/compact_unwind reverted, segalign breaks), features, sections, segment alignment.","restored":"Rebuilt 1928 KB (1,973,328 B), binary runs 3/3, codesign valid, __unwind_info restored (22,952 B). Tree clean.","hypothesis":"Reduce segment-page padding (~14 KB) by forcing 4 KB segment alignment via -Wl,-segalign,0x1000 — the last untested non-behavior-changing lever","next_action_hint":"binary_kb floor 1928 KB now exhaustively closed across every dimension. Remaining levers ALL categorized: crash-diagnostics tradeoff (1900 KB combined / 1912 KB unwind-only — needs user approval), out-of-scope (ring TLS, async reqwest, build-std network, aws-lc algo set), metric-gaming. Loop exhausted; recommend ending unless user approves a tradeoff or provides a new target."}}
{"run":61,"commit":"334814c","metric":1928,"metrics":{"build_seconds":9.605},"status":"keep","description":"Floor verification (1928 KB stable) + closed the last three verifiable 're-examine closed levers' hypotheses with manifest-level evidence. (1) aws-lc-rs 1.18.0 features verified: NO feature reduces the BoringSSL algo set (only legacy-des/fips add code); the set is fixed, and -flto already dead-strips unreachable. (2) rustls TLS 1.2 removal VERIFIED-BLOCKED: reqwest 0.13.4 hard-codes tls12 on rustls/hyper-rustls/tokio-rustls (all default-features=false); Cargo unification can only add, so it can't be disabled without a [patch]-fork of reqwest (source-level dep change, out of scope). (3) rustls logging: already NOT enabled (0 occurrences in feature graph, 0 log symbols in binary) — no dead log code to remove. binary_kb=1928 KB stable (build_seconds 9.6 warm no-op), checks pass. No code change; floor confirmation + verified closures recorded. | hyp: Re-examine the last three 'closed' levers with fresh skepticism: (1) aws-lc algo-set reduction via feature, (2) rustls TLS 1.2 removal via feature config, (3) rustls logging-feature dead code. | next: binary_kb floor 1928 KB definitive — every lever A/B-verified or manifest-verified-impossible. Remaining paths all need user decision: crash-diagnostics tradeoff (1900/1912 KB, quantified), or out-of-scope dep changes. Loop has zero remaining in-scope non-behavior-changing hypotheses. | rollback: n/a (no code change — floor confirmation keep).","timestamp":1788184786063,"segment":1,"confidence":245.25,"asi":{"aws_lc_features_verified":"aws-lc-rs 1.18.0 features verified: only legacy-des/fips/prebuilt-nasm/bindgen/asan — all ADD code or build-related; NO feature reduces the compiled BoringSSL algorithm set. The 'algo set is dep-level' claim is now verified (not assumed): the set is fixed by BoringSSL's build, and -flto dead-strip already removes unreachable code.","tls12_removal_verified_blocked":"rustls tls12 removal is IMPOSSIBLE in-scope (verified at manifest level): reqwest 0.13.4 hard-codes features=['std','tls12'] on rustls, features=['http1','tls12'] on hyper-rustls, features=['tls12'] on tokio-rustls (all default-features=false). Cargo feature unification can only ADD, never subtract — so TLS 1.2 cannot be disabled from our Cargo.toml. Only a [patch]-fork of reqwest (source-level dependency change) could do it — out of autoresearch scope.","logging_already_off":"rustls logging feature: reqwest declares rustls with default-features=false + ['std','tls12'] — logging is NOT enabled in the graph (0 occurrences) and the binary has 0 log symbols. No dead log-message code/strings to remove — the logging angle was already closed.","floor_verified":"binary_kb=1928 KB (1,973,328 B) stable, checks pass (fmt/check/clippy/test). This iteration closed the last three verifiable 'closed-lever re-examinations'; every dimension is now A/B-verified or manifest-verified impossible. Floor definitive.","hypothesis":"Re-examine the last three 'closed' levers with fresh skepticism: (1) aws-lc algorithm-set reduction via feature, (2) rustls TLS 1.2 removal via feature config, (3) rustls logging-feature dead code","next_action_hint":"binary_kb floor 1928 KB definitive — every lever now A/B-verified OR manifest-verified-impossible (aws-lc features, tls12 hard-code, logging off, build-std=network, ring TLS=new dep, async reqwest=arch). Remaining paths ALL need user decision via normal flow: crash-diagnostics tradeoff (1900 KB combined / 1912 KB unwind-only — quantified probes #54/#59), or out-of-scope dep-level changes. Loop has zero remaining in-scope non-behavior-changing hypotheses."}}
{"run":62,"commit":"334814c","metric":1928,"metrics":{"build_seconds":8.81},"status":"discard","description":"Probes (REVERTED, no-ops/closed): (1) -Wl,-mllvm,-enable-constmerge=1 — libLLVMLTO 'Unknown command line argument' — ConstMerge pass NOT exposed via ld64 LTO in this LLVM (link failed, working binary untouched). (2) -Wl,-no_implicit_dylibs — byte-identical 1928 KB, all 5 dylibs explicit/required (consistent with #27). Also completed a full __cstring/__const string audit: ALL content reachable (rustls error table, tokio assertions, hyper HTTP/1.1 preface-detection, URL percent-tables, reason-phrases) — zero dead string weight; and re-verified exact section accounting via size -m (1,973,328 B; the earlier otool '212KB eh_frame' was a parse artifact). binary_kb=1928 KB stable, checks pass, binary runs. Restored floor; tree clean. | hyp: Test the last two untested behavior-preserving linker/LTO flags: ConstMerge on the C-LTO path, -no_implicit_dylibs. | next: binary_kb floor 1928 KB definitive — linker/LTO flag space now exhaustively probed. All remaining paths need user decision: crash-diagnostics tradeoff (1900/1912 KB), out-of-scope dep changes, or reqwest [patch]-fork for TLS 1.2 removal. Loop has zero remaining in-scope non-behavior-changing hypotheses. | rollback: probes ephemeral (cargo rustc, no file change); restored via cargo build --release -> 1928 KB (1,973,328 B), runs 3/3, checks green.","timestamp":1788184953323,"segment":1,"confidence":245.25,"asi":{"constmerge_probe":"-Wl,-mllvm,-enable-constmerge=1: libLLVMLTO reports 'Unknown command line argument -enable-constmerge=1' — the ConstMerge pass is NOT exposed via ld64's LTO in this LLVM version. Link failed (did not overwrite working binary). The one untested constant-merge pass on the C-LTO path is confirmed unavailable.","no_implicit_dylibs_probe":"-Wl,-no_implicit_dylibs: no change (1928 KB, 1,973,328 B byte-identical). All 5 linked dylibs (CoreFoundation/Security/SystemConfiguration/libiconv/libSystem) are explicitly required — no implicit auto-linked dylib to drop. Consistent with exp #27 (all dylibs genuinely referenced).","strings_audit":"Full __cstring/__const string audit confirms ALL content reachable: rustls error-code->message table (3,030 B), tokio assertion messages, hyper HTTP/1.1 HTTP2-preface detection ('PRI * HTTP/2.0' is needed to emit the 'found HTTP2 preface' error — not the h2 crate), URL percent-encoding table, hyper reason-phrase table (~1 KB, canonical_reason). Zero dead string weight.","section_accounting_reverified":"size -m confirms exact byte accounting (previous otool parse showing '212 KB __eh_frame'/'49 KB __bss' was a segment-vmsize parse artifact). __TEXT 1,700,524 + __DATA_CONST 201,384 + __DATA 13,960 + __LINKEDIT = 1,973,328 B = 1928 KB. No hidden sections.","floor_verified":"binary_kb=1928 KB stable, checks pass (exit 0), binary runs 3/3 after restore.","hypothesis":"Test the last two untested behavior-preserving linker/LTO flags: (1) ConstMerge pass on the C-LTO path, (2) -no_implicit_dylibs for unused auto-linked dylibs","next_action_hint":"binary_kb floor 1928 KB definitive. The linker/LTO flag space is now exhaustively probed (every flag either A/B-verified, unrecognized/unavailable, or behavior-changing). All remaining paths need user decision: crash-diagnostics tradeoff (1900/1912 KB), out-of-scope dep changes (ring TLS, build-std network, aws-lc algo set), or a [patch]-fork of reqwest to drop TLS 1.2. Loop has zero remaining in-scope non-behavior-changing hypotheses."}}
{"run":63,"commit":"d088811","metric":1928,"metrics":{"build_seconds":9.6},"status":"keep","description":"Floor verification (1928 KB stable, checks pass) + verified-closed the last unexamined TLS-stack component: rustls-platform-verifier. Both reqwest 0.13.4 rustls variants ('rustls', 'rustls-no-provider') hard-code 'dep:rustls-platform-verifier' — no feature avoids it, feature unification can only add → cannot be disabled in-scope. Its 0.7.0 features have no reduction option (only cert-logging/dbg/docsrs/ffi-testing). Its src/verification/apple.rs is the SOLE source of the Security.framework + CoreFoundation imports. Removal needs a reqwest [patch]-fork (out of scope) + changes CA trust source (keychain vs webpki roots) = behavior. Documented as a fork-decision path (est. tens of KB + framework import drop). No code change; floor confirmation + verified closure recorded. | hyp: Determine whether rustls-platform-verifier (hard-coded macOS cert-verifier pulling Security/CoreFoundation framework imports) can be disabled via reqwest features. | next: binary_kb floor 1928 KB definitive. All remaining levers now categorized into user-decision paths: reqwest fork removing platform-verifier (est. tens KB, CA-trust change), reqwest fork removing tls12 (TLS 1.3-only), crash-diagnostics flags (1900/1912 KB), ring TLS, build-std. Loop has zero in-scope non-behavior-changing hypotheses. | rollback: n/a (no code change — floor confirmation keep).","timestamp":1788185028243,"segment":1,"confidence":245.25,"asi":{"platform_verifier_hardcoded":"rustls-platform-verifier v0.7.0 is hard-coded into BOTH reqwest 0.13.4 rustls feature variants ('rustls' = __rustls-aws-lc-rs + dep:rustls-platform-verifier; 'rustls-no-provider' = rustls-platform-verifier + __rustls). No reqwest feature avoids it; feature unification only adds, so it cannot be disabled in-scope — only a [patch]-fork of reqwest (out of scope).","platform_verifier_no_reduction_features":"rustls-platform-verifier 0.7.0 features = only cert-logging/dbg/docsrs/ffi-testing (all add or test-only) — no size-reduction feature exists.","framework_imports_sourced":"Its src/verification/apple.rs is the SOLE source of the Security.framework + CoreFoundation imports (cargo tree: core-foundation 0.9.4 + 0.10.1 both present, small sys crates). Removing platform-verifier would drop those framework imports + the platform cert-verification code (est. tens of KB), BUT changes CA trust source (keychain vs webpki roots) = behavior change, AND needs a reqwest fork. Documented as a fork-decision path.","floor_verified":"binary_kb=1928 KB stable, checks pass (exit 0).","hypothesis":"Determine whether rustls-platform-verifier (the hard-coded macOS cert-verifier pulling Security.framework/CoreFoundation imports) can be disabled via reqwest features — the last unexamined TLS-stack component","next_action_hint":"binary_kb floor 1928 KB definitive. Verified-closed this iteration: rustls-platform-verifier is hard-coded in all reqwest rustls variants (needs [patch]-fork + changes CA trust = behavior). The fork-decision paths now quantified/categorized: reqwest fork removing platform-verifier (est. tens of KB, CA-trust change), reqwest fork removing tls12 (TLS 1.3-only), crash-diagnostics flags (1900/1912 KB). ALL remaining levers need user approval; loop has zero in-scope non-behavior-changing hypotheses."}}
