{"run":88,"commit":"f617e63","metric":1928,"metrics":{"build_seconds":0},"status":"discard","description":"Probe (REVERTED-into-closure, no build needed): closed the aarch64 LSE-atomic hypothesis at the codegen level. Complete disassembly (331,833 instructions = full __text) shows ZERO LL/SC loops (ldxr/stxr/ldaxr/stlxr = 0) AND ZERO LSE RMW instructions (ldadd/cas/swp = 0). The only atomics are 66 compact single-instruction ordered forms (ldar 30, stlr 19, ldarb 13, stlrb 4). DOUBLE-FALSIFIED: rustc --print cfg confirms target_feature=\"lse\" is already on by default (apple-m1), and there are no LL/SC sequences to convert regardless. std Mutex delegates to libSystem on macOS; tokio's blocking runtime keeps almost no RMW atomics in-binary. The atomic/ISA dimension is closed with disassembly-level evidence — atomics are already maximally compact. binary_kb=1928 KB (1,973,328 B, 482 blocks) verified via WORKLOAD=size, runs 3/3, checks exit 0, tree clean. No code change kept. | hyp: The default codegen uses LL/SC loops (ldxr/stxr); enabling +lse compiles them to single-instruction atomics (ldadd/cas), shrinking the mutex/atomic sites in tokio/hyper/rustls by several KB. | next: binary_kb floor 1928 KB definitive. The atomic/ISA dimension is now closed at the disassembly level (already +lse, zero LL/SC, atomics maximally compact). 88 experiments; zero in-scope hypotheses remain across every dimension. Only user-decision paths remain: crash-diagnostics flags (1896 KB), reqwest fork (platform-verifier/tls12), build-std (network). Recommend ending the loop. | rollback: n/a (diagnostic closure — no build, no config change; floor verified intact).","timestamp":1788187844074,"segment":1,"confidence":109,"asi":{"lse_hypothesis_falsified_at_codegen_level":"Probed the aarch64 LSE atomic hypothesis with a complete disassembly (331,833 instructions = full __text 1,332,108 B / 4 B, verified against wc -l). RESULT: the binary has ZERO LL/SC loops (ldxr=0, stxr=0, ldaxr=0, stlxr=0) AND ZERO LSE RMW instructions (ldadd=0, cas=0, swp=0). The only atomics are 66 compact single-instruction ordered forms (ldar 30, stlr 19, ldarb 13, stlrb 4). DOUBLE-FALSIFICATION: (1) rustc --print cfg for aarch64-apple-darwin confirms target_feature=\"lse\" is ALREADY ON by default (apple-m1 CPU); (2) even without it there are no LL/SC sequences to convert. std Mutex on macOS delegates to libSystem (pthread/os_unfair_lock), and tokio's blocking runtime keeps almost no RMW atomics in-binary — all remaining atomics already use the compact ldar/stlr form. No +lse build was even necessary.","atomic_dimension_closed":"The atomic-instruction/codegen-ISA dimension is now closed with disassembly-level evidence: the binary's atomics are already maximally compact (single-instruction ldar/stlr, zero exclusive loops, zero RMW). No target-feature change can shrink them.","floor_intact":"binary_kb=1928 KB (1,973,328 B, 482 blocks) verified through WORKLOAD=size, runs 3/3, checks exit 0. Tree clean (f617e63).","hypothesis":"The default codegen uses LL/SC loops (ldxr/stxr, ~5-8 instructions per atomic op); enabling the +lse target feature compiles them to single-instruction atomics (ldadd/cas), shrinking the many mutex/atomic sites in tokio/hyper/rustls by several KB","next_action_hint":"binary_kb floor 1928 KB definitive. The atomic/ISA dimension is now closed at the disassembly level (already +lse, zero LL/SC, atomics maximally compact). 88 experiments; zero in-scope hypotheses remain across every dimension. Only user-decision paths remain: crash-diagnostics flags (1896 KB), reqwest fork (platform-verifier/tls12), build-std (network). Recommend ending the loop."}}
{"run":89,"commit":"7075cb1","metric":1928,"metrics":{"build_seconds":13.53},"status":"keep","description":"NOP-density audit (keep, read-only diagnostic): binary contains 3,138 NOPs (~12,552 B = 0.95% of __text), 2,738 as adr;nop pairs — aarch64-Darwin blind-reference (PAC-slot) form. rustc emits plain adr (our rcgu obj: 224 adr/0 nop); nop added by linker LTO backend (both ld64 & rust-lld). std (prebuilt O3) natively has ~900; deps add ~1,800 at LTO link. CLOSED: -paca/-pacg/-pauth-lr/-fpac all leave nops unchanged AND regress +16KB (PAC features size-positive); -aarch64-enable-pac=false no-op. DECISIVE: adr;nop (8B) == adrp;add (8B) size-identical, no 4-byte form exists on this ABI — nops are intrinsic density, zero removable bytes. Floor 1928 KB (1,973,328 B, sha 62cfb0860ad403df) intact, binary runs, checks pass.","timestamp":1788188488689,"segment":1,"confidence":109,"asi":{"hypothesis":"The ~12.5 KB of NOPs in __text (0.95%, never examined in 88 experiments) might be removable via PAC target-features or an ld64 LTO flag","result":"FALSIFIED — nops are intrinsic aarch64-Darwin LTO-backend blind-reference padding","mechanism":"rustc -Oz emits adrp;add (or plain adr); the linker LTO backend converts to adr;nop (8B) which is size-identical to adrp;add (8B) — the PAC slot cancels the adrp;add->adr savings. No 4-byte pc-relative form exists on this ABI","evidence":"our rcgu obj 224 adr/0 nop; empty-main std baseline 917-1027 nop; ld64==rust-lld both emit it; paca/pacg/pauth-lr/fpac leave nops at 3140 and regress size +16KB; aarch64-enable-pac=false no-op","next_action_hint":"binary_kb floor 1928 KB definitive. NOP dimension closed — every byte of __text now accounted. No in-scope hypothesis remains; only user-decision paths (crash-diagnostics 1896/1908/1916 KB, reqwest fork, build-std=network)"}}
{"run":90,"commit":"f617e63","metric":1928,"metrics":{"build_seconds":39.33},"status":"discard","description":"Matrix-gap probe (REVERTED-into-closure): thin LTO x codegen-units=1 — the one LTO x cgu cell never A/B'd (#19 tested thinx16=2876, #44 fatx16=2028, kept fatx1=1928). Result: binary_kb 1928 -> 2176 KB (+248 KB, +12.9% regression), build_seconds 39.3s. Confirms thin LTO cannot do the cross-crate dead-code elimination + monolith inlining that fat LTO achieves regardless of codegen-units; cgu=1 makes thin only marginally better than thinx16. Full LTO x cgu matrix now closed: fatx1=1928 (optimal), fatx16=2028, thinx1=2176, thinx16=2876. Config reverted via cp backup; floor 1928 KB (1,973,328 B, sha 62cfb0860ad403df) restored, binary runs, checks green. Also verified the kept config integrity this iteration (Cargo.toml/.cargo/config.toml/build.rs all exact documented state).","timestamp":1788188670223,"segment":1,"confidence":109,"asi":{"hypothesis":"Fill the one documented LTO x codegen-units matrix gap: thin LTO at cgu=1 might approach fat LTO size (never tested; only thinx16=2876 in #19)","result":"FALSIFIED — thinx1 = 2176 KB (+248 KB vs fatx1=1928), still much worse","mechanism":"thin LTO optimizes per-crate with cross-crate summaries; it cannot merge+inline across all 165 crates the way fat LTO does, so the monolith formation and cross-crate DCE (-864 KB win) is fat-LTO-specific regardless of cgu","evidence":"complete matrix now closed: fatx1=1928 (kept), fatx16=2028 (#44), thinx1=2176 (this), thinx16=2876 (#19)","rollback_reason":"primary metric regressed +248 KB; config reverted via cp backup","next_action_hint":"binary_kb floor 1928 KB definitive — LTO x cgu matrix now fully closed (last gap filled). 90 experiments; zero in-scope non-behavior-changing hypotheses remain across every dimension. Only user-decision paths remain: crash-diagnostics flags (1896 KB), reqwest fork (platform-verifier/tls12), build-std (network). Recommend ending the loop unless the user approves a tradeoff or provides a new target."}}
{"run":91,"commit":"f617e63","metric":1928,"metrics":{"build_seconds":14.15},"status":"discard","description":"Codegen-flag closure (REVERTED-into-closure): the last never-probed rustc codegen option with a size mechanism — -C code-model. code-model=tiny is REJECTED by LLVM for this target: 'rustc-LLVM ERROR: tiny code model is only supported on ELF' (exit 101 at rustc info probe, before any compile/link — working binary untouched). code-model=small is the aarch64-Darwin default; large would only add addressing overhead; kernel unsupported. The code-model dimension is therefore closed by construction: only 'small' is legal on Mach-O arm64 and it is already active. Combined with #89 (adr;nop == adrp;add, no 4-byte ref form exists), there is no code-model path to smaller references. Config reverted via cp backup; floor 1928 KB (1,973,328 B, sha 62cfb0860ad403df) restored, binary runs, checks green.","timestamp":1788188771083,"segment":1,"confidence":109,"asi":{"hypothesis":"The one rustc codegen flag with a plausible size mechanism never probed in 90 experiments — -C code-model=tiny could shorten pc-relative references (replacing adr;nop/adrp;add pairs with direct adr)","result":"FALSIFIED — tiny is ELF-only; LLVM rejects it on Mach-O arm64","mechanism":"rustc-LLVM ERROR: tiny code model is only supported on ELF — Mach-O arm64 supports only the small code model (already default), so the code-model dimension is closed by construction","evidence":"probe failed at the rustc info stage (exit 101) before any compile/link; small is default; large adds addressing overhead; kernel unsupported","rollback_reason":"probe unavailable on this target; config reverted via cp backup, floor restored to 1928 KB sha-identical, checks green","next_action_hint":"binary_kb floor 1928 KB definitive. The codegen-attribute space is now 100% closed (every -C flag + llvm-args + code-model probed or proven impossible). 91 experiments; zero in-scope non-behavior-changing hypotheses remain across every dimension. Only user-decision paths remain: crash-diagnostics flags (1896 KB), reqwest fork (platform-verifier/tls12), build-std (network), ring TLS (new dep)."}}
{"run":92,"commit":"c579ba4","metric":1928,"metrics":{"build_seconds":13.88},"status":"keep","description":"Major discovery — largest remaining lever identified and classified OUT OF SCOPE. Ran a full linker-map const audit (cargo rustc -C link-arg=-Wl,-map): the 1928 KB binary contains a complete post-quantum crypto stack — C-side aws-lc ML-KEM-512/768/1024 + ML-DSA-44/65/87 (65,996 B = 64.4 KB of __text in 216 syms) + rustls pq::mlkem (1,560 B) + ~12 KB PQ const tables = ~78 KB total (would move binary_kb 1928 -> ~1848 KB, -4.1%, the biggest lever since original profile work). Root cause: rustls 0.23.43 aws_lc_rs default provider includes 4 PQ KX groups (X25519MLKEM768 in DEFAULT_KX_GROUPS unconditionally; prefer-post-quantum feature only reorders). Two anchors, both capability changes: (1) ML-KEM via rustls default KX list — removable only via custom CryptoProvider (needs rustls as direct dep + src change); (2) ML-DSA via aws-lc EVP_PKEY/ASN1 cert-parsing machinery (live _pqdsa_* method table) — effectively immutable. NOT DONE: removing PQ key exchange is a security-capability removal, not behavior-preserving — a security downgrade dressed as a size win (cheat-the-benchmark category, same as reverted system-proxy #16 / crash-diagnostics #54/#59). Recorded as user-decision path in ideas.md. Verified floor intact after the map relink (map altered byte content but not size; clean build reproduces exact sha 62cfb0860ad403df, 1,973,328 B, 482 blocks). WORKLOAD=size: binary_kb=1928. Checks passed (fmt/check/clippy/test exit 0). Binary smoke exit 0.","timestamp":1788189151587,"segment":1,"confidence":109,"asi":{"hypothesis":"A full linker-map audit of __const (the one 21%-of-binary region never broken down to object level) would reveal whether any const object is removable — the first object-level composition analysis of the binary","result":"Found the largest undiscovered lever of the session: ~78 KB of post-quantum crypto (ML-KEM + ML-DSA) pulled in by rustls's default PQ KX groups. But it is OUT OF SCOPE — removing PQ is a security-capability removal (not behavior-preserving), needs user approval via normal flow. No dead const weight otherwise (X25519/ed25519 48.5 KB tables + ASN1 OID table all required).","next_action_hint":"User decision path (normal approval flow): if hybrid-PQ TLS key exchange can be sacrificed, add rustls as direct dep + install custom CryptoProvider excluding the 4 PQ KX groups -> est. ~1848 KB (ML-KEM ~50 KB + ~12 KB tables; ML-DSA via cert-parsing likely not removable even then). This is the largest remaining lever by far. Otherwise binary_kb floor 1928 KB stands — zero in-scope non-behavior-changing hypotheses remain."}}
{"run":93,"commit":"c579ba4","metric":1928,"metrics":{"build_seconds":14.93},"status":"discard","description":"Probe (REVERTED, hypothesis falsified): quantified the #92 PQ lever via a temporary [patch]-fork of rustls-0.23.43 removing the 4 PQ KX groups (X25519MLKEM768, SECP256R1MLKEM768, MLKEM768, MLKEM1024) from DEFAULT_KX_GROUPS + ALL_KX_GROUPS. RESULT: binary_kb UNCHANGED at 1928 KB (file 1,973,328 -> 1,973,264 B, net -64 B); __text only -4,644 B (Rust-side rustls pq module + directly-anchored C entry points) with ~4,580 B growing elsewhere from codegen/outliner shifts. The C-side ML-KEM/ML-DSA (~66 KB) stayed in the binary. ROOT CAUSE: the ~78 KB PQ stack is anchored by aws-lc's INTERNAL EVP/crypto algorithm registry (live _pqdsa_* method table + ML-KEM EVP entries), reachable via the cert/SPKI key-parsing path rustls uses on every connection — NOT by the rustls KX-group list. PQ is NOT removable by any rustls-level config; only an aws-lc build change (no such feature exists, #61 verified features only ADD) or removing cert-parsing (behavior) would do it — both out of scope. The #92 estimate \"~1848 KB via custom CryptoProvider\" is RETRACTED (a custom provider nets ~-64 B). Config fully reverted (Cargo.toml restored, /tmp/pqprobe removed); floor restored byte-exact sha 62cfb0860ad403df, 1,973,328 B, 482 blocks. WORKLOAD=size: binary_kb=1928. Checks passed (fmt/check/clippy/test exit 0). Binary smoke exit 0. Tree clean (only .auto/ files).","timestamp":1788189380982,"segment":1,"confidence":109,"asi":{"hypothesis":"The ~78 KB post-quantum stack (ML-KEM + ML-DSA) discovered in #92 might be removable by removing the 4 PQ KX groups from rustls's default provider (custom CryptoProvider-equivalent), taking binary_kb 1928 -> ~1848 KB. Probe via temporary [patch]-fork of rustls-0.23.43 to quantify exactly, then revert.","result":"HYPOTHESIS FALSIFIED: removing X25519MLKEM768/SECP256R1MLKEM768/MLKEM768/MLKEM1024 from DEFAULT_KX_GROUPS + ALL_KX_GROUPS left binary_kb UNCHANGED at 1928 KB (file 1,973,328 -> 1,973,264 B, net -64 B). __text only -4,644 B (the Rust-side rustls pq module + directly-anchored C entry points); ~4,580 B grew elsewhere from codegen/outliner shifts. The C-side ML-KEM/ML-DSA (~66 KB) stayed in the binary. ROOT CAUSE: the PQ stack is anchored by aws-lc's INTERNAL EVP/crypto algorithm registry (live _pqdsa_* method table + ML-KEM EVP entries), reachable via the cert/SPKI key-parsing path rustls uses on EVERY connection - not by the KX-group list. PQ is NOT removable by any rustls-level config; only an aws-lc build change (no feature exists; #61 verified features only add) or removing cert-parsing (behavior) would do it. Both out of scope. The #92 '~1848 KB via custom provider' estimate is RETRACTED - a custom provider nets ~-64 B.","next_action_hint":"binary_kb floor 1928 KB definitive - the largest undiscovered lever (PQ, #92) is now QUANTIFIED and CLOSED (nets -64 B, C-side anchored in aws-lc internal registry). The #92 estimate is corrected in ideas.md. All levers across every dimension are now A/B-verified or proven-impossible-with-evidence. Only genuine user-decision paths remain: crash-diagnostics flags (1896 KB, quantified #54/#59). Zero in-scope non-behavior-changing hypotheses remain; recommend ending the loop."}}
{"run":94,"commit":"23c569d","metric":1928,"metrics":{"build_seconds":13.5},"status":"keep","description":"Read-only diagnostic (keep — no code change): quantified the two reqwest [patch]-fork decision paths exactly via the linker map (which preserves symbol names pre-strip; cargo rustc -C link-arg=-Wl,-map). (1) platform-verifier removal: standalone live __text 3,488 B (29 syms, most LTO-inlined into reqwest/rustls callers) + 27 Security/CoreFoundation framework imports (10 _Sec* + 17 _CF* out of 202 undefined) ≈ ~1,944 B in __stubs/__got/strings/nlist + 2 LC_LOAD_DYLIB commands (Security.framework + CoreFoundation removed entirely) = realistic ~5-11 KB total, borderline 1 du step (1928 -> ~1924 KB) IF inlined code pushes past the 3,152 B threshold. CORRECTS the #63 'tens of KB' estimate — it was an overestimate. (2) TLS 1.2 removal: rustls-side 1.2 protocol code ~20.6 KB + C-side tls1_prf/CBC ~20.8 KB (RSA 20.3 KB only partially removable — TLS 1.3 keeps RSA certs) = realistic ~30-40 KB -> binary_kb ~1892-1896 KB. This is the BIGGEST fork-path lever but the most serious connectivity behavior change (~30% of web servers are TLS 1.2-only). Complete decision matrix now quantified: crash-diagnostics flags 1896 KB (build.rs), TLS 1.2 removal ~1892-1896 KB, platform-verifier removal ~1920-1924 KB — ALL behavior changes requiring user approval via normal flow. Floor re-verified byte-exact: clean rebuild -> sha 62cfb0860ad403df, 1,973,328 B, 482 blocks. WORKLOAD=size: binary_kb=1928. Checks passed (fmt/check/clippy/test exit 0). Binary smoke exit 0. Tree clean (only .auto/ files).","timestamp":1788189559897,"segment":1,"confidence":109,"asi":{"hypothesis":"Quantify the two reqwest [patch]-fork decision paths (platform-verifier removal, TLS 1.2 removal) with exact numbers from the linker map, so the user has accurate data for the fork decisions — the map preserves symbol names pre-strip (read-only, no build risk).","result":"COMPLETE DECISION MATRIX NOW QUANTIFIED: (1) platform-verifier: standalone live __text 3,488 B (29 syms, most LTO-inlined) + 27 Security/CoreFoundation imports (10 _Sec* + 17 _CF* of 202 total) ~1,944 B in stubs/GOT/strings + 2 dylib load commands = realistic 5-11 KB total, borderline 1 du step (1928->~1924 KB) IF inlined code passes 3,152 B. The #63 'tens of KB' estimate was an OVERESTIMATE. (2) TLS 1.2 removal: rustls 1.2 protocol ~20.6 KB + C-side tls1_prf/CBC ~20.8 KB, RSA (20.3 KB) only partially removable (1.3 keeps RSA) = realistic ~30-40 KB -> ~1892-1896 KB, the BIGGEST fork lever but the most serious connectivity change (~30% of servers TLS 1.2-only). (3) Crash-diagnostics flags (already known): 1896 KB. All three are behavior changes needing user approval. Floor re-verified byte-exact (sha 62cfb0860ad403df, 1,973,328 B, 482 blocks, binary_kb=1928), checks pass.","next_action_hint":"User decision (normal approval flow) on the three quantified behavior-changing levers: crash-diagnostics flags 1896 KB, TLS 1.2 removal ~1892-1896 KB, platform-verifier removal ~1920-1924 KB. Zero in-scope non-behavior-changing hypotheses remain across every dimension (94 experiments). Recommend ending the loop."}}
