{"run":95,"commit":"30fa362","metric":1928,"metrics":{"build_seconds":13.5},"status":"keep","description":"Read-only diagnostic (keep — no code change): definitive crate-level origin attribution of __text (1,332,108 B), the one composition analysis never done at symbol level. Parsed the ld64 linker map (preserves symbol names pre-strip) excluding section-header lines: 10,291 live symbols in __text range sum to 1,331,604 B ≈ 100% of the section. Attribution: aws-lc C (BoringSSL) 465,288 B = 34.9% (6,140 syms) | rustls 191,408 = 14.4% | reqwest 144,684 = 10.9% | Rust std (core+std+alloc) 194,096 = 14.6% | our code (myagent) 62,616 = 4.7% (188 syms) | asm/linker-local (s2n-bignum + armv8 perlasm + machine-outliner anon/ltmp) 27,320 = 2.1% | webpki 26,292 = 2.0% | http 25,472 = 1.9% | tokio 22,544 = 1.7% | url 21,676 = 1.6% | rustls_pki_types 20,412 = 1.5% | hyper 17,596 = 1.3% | idna 17,124 = 1.3% | serde_json 15,600 = 1.2% | rest < 1.1% each. TLS stack total (aws-lc C + aws_lc_rs + rustls + pki_types + webpki + platform-verifier) ≈ 715 KB = 53.7% of __text — the dominant component, intrinsic for HTTPS. HTTP stack (reqwest+hyper+hyper_util+http) ≈ 202 KB = 15.2%, all minimal. NO surprise lever: every component is intrinsic and all levers are already closed (PQ falsified #93, fork paths quantified #94, ring = new dep, std = build-std network-blocked). The 27 KB anon/ltmp is the machine outliner's compact output (the -32/-16 KB wins), not removable waste. Also corrected a false alarm: the earlier 'map sizes inflated 2x' was the __TEXT section-header line polluting the sum — real symbol sizes sum exactly. Floor verified byte-exact (sha 62cfb0860ad403df, 1,973,328 B, 482 blocks). WORKLOAD=size: binary_kb=1928. Checks passed (fmt/check/clippy/test exit 0). Binary smoke exit 0. Tree clean (only .auto/ files).","timestamp":1788189745369,"segment":1,"confidence":109,"asi":{"hypothesis":"Produce the definitive crate-level origin attribution of the 1,332,108 B __text — the one composition analysis never done at symbol level — which both documents the binary and may surface a surprise lever.","result":"COMPLETE __text ORIGIN ATTRIBUTION (10,291 live symbols from the ld64 map minus section-header lines; sum 1,331,604 B = 100% of section). aws-lc C (BoringSSL) 465,288 B = 34.9% (6,140 syms) | rustls 191,408 = 14.4% | reqwest 144,684 = 10.9% | Rust std core+std+alloc 194,096 = 14.6% | our code (myagent) 62,616 = 4.7% | asm/linker-local (s2n-bignum/armv8 perlasm + outliner anon/ltmp) 27,320 = 2.1% | webpki 2.0% | http 1.9% | tokio 1.7% | url 1.6% | rest < 1.5% each. TLS stack total ~715 KB = 53.7% of __text (intrinsic for HTTPS). HTTP stack ~202 KB = 15.2% (all minimal). NO surprise lever: every component intrinsic; all levers already closed (PQ #93, fork paths #94, ring, build-std). The 27 KB anon/ltmp is the machine outliner's compact output (the -32/-16 KB wins), not waste. Also corrected the earlier 'map sizes inflated 2x' false alarm — the pollution was the __TEXT section-header line; real symbol sizes sum exactly.","next_action_hint":"binary_kb floor 1928 KB definitive with the complete composition documented. 95 experiments; zero in-scope non-behavior-changing hypotheses remain. Only user-decision paths remain: crash-diagnostics flags (1896 KB), reqwest fork (TLS 1.2 ~1892-1896 KB / platform-verifier ~1920-1924 KB), build-std (network). Recommend ending the loop."}}
{"run":96,"commit":"b2dcd42","metric":1928,"metrics":{"build_seconds":13.5},"status":"keep","description":"Read-only diagnostic (keep — no code change): dissected the last two never-examined structural corners of the binary. (1) __data (5,376 B) fully dissected at symbol level: 54 symbols / 4,944 B, 100% intrinsic — the 2,400 B std backtrace gimli Cache (panic-hook symbolizer, intrinsic to std even with panic=abort, only removable via build-std=network), 896 B = 56 aws-lc *_once EVP-registry one-time-init flags (all reachable via cert/key parsing), 6 x 16 B PQ method_onces (kem_ml_kem_512/768/1024, sig_ml_dsa_44/65/87) = DIRECT runtime-registry evidence that ML-KEM/ML-DSA are registered in aws-lc's EVP table at process init independent of rustls KX groups — supplements #93's closure, 1,384 B MergedGlobals + g_ex_data_class + added_lock + tokio/std counters (all runtime primitives). (2) Framework-import surface confirmed: 202 undefined = 175 libSystem/C + 27 Security/CoreFoundation (10 _Sec* + 17 _CF*, the rustls-platform-verifier macOS cert-verifier) + SystemConfiguration proxy path — matches #94 exactly. ZERO removable bytes in __data. This closes the LAST un-dissected structural corner — the binary is now 100% attributed across every corner: __text (#95 origin), __const (#62 strings + #92 map), __LINKEDIT (#66-69), __data + imports (this), segments/padding (#68/#70). Floor byte-exact (sha 62cfb0860ad403df, 1,973,328 B, 482 blocks, binary_kb=1928). Checks passed (fmt/check/clippy/test exit 0). Binary smoke exit 0. Tree clean (only .auto/ files). Finding recorded in ideas.md.","timestamp":1788189850226,"segment":1,"confidence":109,"asi":{"hypothesis":"Dissect the last two never-examined structural corners of the binary: __data (5,376 B of initialized mutable globals) and the identity of the 202 undefined framework imports — to complete the 'every byte owned' accounting and check for any removable runtime state.","result":"COMPLETE. (1) __data fully dissected (54 symbols / 4,944 B, 100% intrinsic): 2,400 B std backtrace gimli Cache (panic-hook symbolizer; panic=abort still runs the hook; only build-std could remove it = network-blocked), 896 B = 56 aws-lc *_once EVP-registry init flags (all reachable), 6 x 16 B PQ method_onces = DIRECT runtime evidence ML-KEM/ML-DSA are registered in aws-lc EVP table independent of rustls KX groups (supplements #93), 1,384 B MergedGlobals + g_ex_data + added_lock + tokio/std counters (all runtime primitives). (2) Framework imports confirmed 202 = 175 libSystem/C + 27 Security/CoreFoundation (10 _Sec* + 17 _CF*, platform-verifier) + SystemConfiguration proxy path — matches #94 exactly. ZERO removable bytes in __data. Closes the LAST un-dissected structural corner; binary now 100% attributed across every corner (__text #95, __const #62/#92, __LINKEDIT #66-69, __data + imports this, padding #68/#70). No lever.","next_action_hint":"binary_kb floor 1928 KB definitive, now 100% byte-attributed across every corner. 96 experiments; zero in-scope non-behavior-changing hypotheses remain. Only user-decision paths remain: crash-diagnostics flags (1896 KB), reqwest fork (TLS 1.2 ~1892-1896 / platform-verifier ~1920-1924), build-std (network). Recommend ending the loop."}}
{"run":97,"commit":"98feb83","metric":1928,"metrics":{"build_seconds":13.5},"status":"keep","description":"Read-only diagnostic (keep — no code change): completed the crate-level attribution of __const (both regions) and __cstring with exact section address ranges — the data regions never attributed at symbol level with precise bounds. Result: __TEXT.__const (223,496 B) = 72.9% .L-labeled crypto tables (162,547 B, 1,894 syms) + 21.6% aws-lc-C (48,207 B) + serde_json POW10/core/rust-other ~8 KB; __DATA_CONST.__const (199,760 B) = 71.0% aws-lc-C (141,752 B, 28 large objects) + 28.9% .L-labeled (57,752 B). Largest const objects verified intrinsic: _curve25519_x25519base_byte_constant + _edwards25519_scalarmulbase_constant (48,576 B each — TLS 1.3 KX + Ed25519 cert tables), _kObjects ASN1 OID registry 39,960 B + _kObjectData 6,350 B (cert/SPKI parsing), _fiat_p256_g_pre_comp 13,312 B, _mlkem_rej_uniform_table + _mldsa_rej_uniform_eta_table 4,096 B each (PQ, reachable per #93), _kPrimes 2,048 B, _kNIDsInShortNameOrder 1,960 B, serde_json POW10 2,472 B, and a 50,012 B linker-merged l_anon (compressed duplicate constants). __cstring (76,460 B) 100% reachable (audited #62); strings carry no crate prefix in the map (expected). CONCLUSION: ~92% of the 423 KB __const is crypto-library data, ALL required by reachable TLS/cert paths — zero dead const. The binary is definitively a TLS/crypto library (aws-lc + rustls, ~55% of code + ~92% of const) wrapped in a thin agent shell (62.6 KB / 4.7%). This COMPLETES the every-byte-owned accounting with exact section ranges across every corner: __text (#95) + __const both regions (this) + __cstring (#62) + __data (#96) + __LINKEDIT (#66-69) + segments/padding (#68/#70). Floor byte-exact (sha 62cfb0860ad403df, 1,973,328 B, 482 blocks, binary_kb=1928). Checks passed (fmt/check/clippy/test exit 0). Binary smoke exit 0. Tree clean (only .auto/ files). Finding recorded in ideas.md.","timestamp":1788189933552,"segment":1,"confidence":109,"asi":{"hypothesis":"Complete the crate-level attribution of __const (both regions) and __cstring using exact section address ranges — the two data regions never attributed at symbol level with precise bounds (my #96 attempt lumped ranges and got a muddy 'other' bucket) — to finish the every-byte-owned accounting.","result":"COMPLETE. __TEXT.__const (223,496 B): 72.9% .L-labeled crypto tables (162.5 KB) + 21.6% aws-lc-C (48 KB) + serde_json/core/rust-other ~8 KB. __DATA_CONST.__const (199,760 B): 71.0% aws-lc-C (141.8 KB in 28 large objects) + 28.9% .L-labeled (57.8 KB). Largest const objects all intrinsic: X25519/ed25519 base-point tables (48,576 B each, required for TLS 1.3 KX + Ed25519 certs), _kObjects ASN1 OID registry 39,960 B (cert parsing), fiat_p256_g_pre_comp 13,312 B, the two 4 KB PQ rej_uniform tables (reachable per #93), kPrimes 2,048 B, serde_json POW10 2,472 B, and a 50,012 B linker-merged l_anon (compressed duplicate constants). __cstring 76,460 B all reachable (#62). CONCLUSION: ~92% of the 423 KB __const is crypto-library data, ALL required by reachable TLS/cert paths — zero dead const. The binary is definitively a TLS/crypto library (~55% code + ~92% const) wrapped in a thin 62.6 KB agent shell. COMPLETES the every-byte-owned accounting with exact section ranges across every corner.","next_action_hint":"binary_kb floor 1928 KB definitive, every byte owned and attributed across every corner (__text #95, __const this, __cstring #62, __data #96, __LINKEDIT #66-69, padding #68/#70). 97 experiments; zero in-scope non-behavior-changing hypotheses remain. Only user-decision paths remain: crash-diagnostics flags (1896 KB), reqwest fork (TLS 1.2 ~1892-1896 / platform-verifier ~1920-1924), build-std (network). Recommend ending the loop."}}
{"run":98,"commit":"98feb83","metric":1928,"metrics":{"build_seconds":42.9},"status":"discard","description":"Probe (REVERTED-into-closure): tested the genuinely-untested C-side codegen knob -fno-unroll-loops on the aws-lc C compile. Also re-verified the 'OPENSSL_SMALL already active' claim against aws-lc-sys-0.44.0 source (builder/main.rs is_small() returns true for OPT_LEVEL='z' -> -DOPENSSL_SMALL=1 genuinely applied — #36/#50 claim CONFIRMED, no hidden lever there). RESULT: -fno-unroll-loops is SIZE-NEUTRAL. Flag confirmed applied (build log contains it; build_seconds 42.9s = full C rebuild). Binary byte-identical file SIZE 1,973,328 B / binary_kb=1928, though the sha changed (01ef5707 vs baseline) proving the C code did change but netted zero bytes — -Oz's unroll decisions were already size-optimal. Reverted to baseline config; restore rebuild deterministic (sha 9303d3e2 stable across 2 rebuilds, 1,973,328 B, 1928 KB). Checks exit 0. The C-side CFLAGS space is now closed even further: -Oz (#36), -flto (#55), -fvisibility=hidden (#51), OPENSSL_SMALL (verified active this iteration), -fno-unroll-loops (this, size-neutral). binary_kb floor 1928 KB intact. No code change kept.","timestamp":1788190440637,"segment":1,"confidence":109,"asi":{"hypothesis":"Probe the genuinely-untested C-side codegen knob -fno-unroll-loops: -Oz still unrolls some loops (when the unrolled form is smaller); explicitly disabling ALL loop unrolling on the aws-lc C compile (34.9% of __text) might remove unrolled copies for additional KB. Also re-verified the 'OPENSSL_SMALL already active' claim (#36/#50) against aws-lc-sys-0.44.0 source: is_small() returns true for OPT_LEVEL=z, so -DOPENSSL_SMALL=1 is genuinely applied — claim CONFIRMED, no extra lever there.","result":"NO-OP (size-neutral). Flag confirmed applied to the aws-lc C compile (build log contains -fno-unroll-loops; build_seconds 42.9s = full C rebuild happened). Binary 1,973,328 B / binary_kb=1928 — byte-identical file SIZE, though the sha changed (01ef5707 vs the baseline) proving the C code DID change but netted zero bytes. -Oz's loop-unroll decisions were already size-optimal; disabling unrolling neither helps nor hurts. Reverted to baseline config (CFLAGS=-Oz -fvisibility=hidden -flto); restore rebuild deterministic at sha 9303d3e2, 1,973,328 B, 1928 KB, checks exit 0. NOTE: fresh C recompile gives sha 9303d3e2 (not the historical 62cfb086 which was from warm rebuilds with cached C objects) — the C compile embeds build nondeterminism but is deterministic per-config going forward and the du metric is unaffected.","next_action_hint":"binary_kb floor 1928 KB intact. C-side CFLAGS space now closed even further: -Oz (#36), -flto (#55), -fvisibility=hidden (#51), OPENSSL_SMALL (verified active this iteration), -fno-unroll-loops (this, size-neutral). 98 experiments; zero in-scope non-behavior-changing hypotheses remain. Only user-decision paths: crash-diagnostics flags (1896 KB), reqwest fork (TLS 1.2 ~1892-1896 / platform-verifier ~1920-1924), build-std (network)."}}
{"run":99,"commit":"98feb83","metric":1928,"metrics":{"build_seconds":42.3},"status":"discard","description":"Probe (REVERTED-into-closure): the last untested C-codegen corner — disable ALL auto-vectorization on the aws-lc C compile (-fno-vectorize -fno-slp-vectorize). Flag confirmed applied (output log contains fno-vectorize; build_seconds 42.3s = full C rebuild). RESULT: REGRESSION +48 B (file 1,973,376 vs baseline 1,973,328 B) — sub-block noise (binary_kb still 1928), but proves -Oz's auto-vectorization (SLP on struct-copy patterns) is size-POSITIVE; disabling it makes the binary slightly bigger. The -Oz vectorization decisions were already size-optimal. Reverted to baseline config; restore rebuild deterministic (sha 9303d3e2, 1,973,328 B, 1928 KB). Checks exit 0. C-side codegen now fully closed: -Oz (#36), -flto (#55), -fvisibility=hidden (#51), OPENSSL_SMALL (#98 verified active), -fno-unroll-loops (#98 neutral), -fno-vectorize/-fno-slp-vectorize (this, +48 B). binary_kb floor 1928 KB intact. No code change kept.","timestamp":1788190726104,"segment":1,"confidence":109,"asi":{"hypothesis":"Probe the last untested C-codegen corner: disable ALL auto-vectorization on the aws-lc C compile via -fno-vectorize -fno-slp-vectorize. -Oz minimizes vectorization but the SLP vectorizer can still fire on struct-copy/memcpy patterns (often emitting a single 128-bit move that is SMALLER than scalar copies); explicitly disabling all vectorization is a behavior-preserving codegen choice never probed on the C side.","result":"REGRESSION +48 B. Flag confirmed applied to the aws-lc C compile (output log contains fno-vectorize; build_seconds 42.3s = full C rebuild). File 1,973,376 B vs baseline 1,973,328 B (+48 B) — sub-block noise, still 482 x 4KB blocks = binary_kb 1928, but PROVES -Oz's auto-vectorization (SLP on struct copies) is size-POSITIVE: disabling it makes the binary slightly bigger. The -Oz vectorization decisions were already size-optimal. Reverted to baseline (CFLAGS=-Oz -fvisibility=hidden -flto); restore rebuild deterministic sha 9303d3e2, 1,973,328 B, 1928 KB, checks exit 0.","next_action_hint":"binary_kb floor 1928 KB intact. The C-codegen corner is now fully closed: -Oz (#36), -flto (#55), -fvisibility=hidden (#51), OPENSSL_SMALL (verified active #98), -fno-unroll-loops (#98, neutral), -fno-vectorize/-fno-slp-vectorize (this, +48 B regression). The C compile's codegen choices are all -Oz-optimal. 99 experiments; zero in-scope non-behavior-changing hypotheses remain. Only user-decision paths: crash-diagnostics flags (1896 KB), reqwest fork (TLS 1.2 ~1892-1896 / platform-verifier ~1920-1924), build-std (network)."}}
{"run":100,"commit":"98feb83","metric":1928,"metrics":{"build_seconds":15.9},"status":"discard","description":"Probe (REVERTED-into-closure): the literal last untested ld64 linker flag -Wl,-no_eh_labels (label-symbol generation for __eh_frame FDEs). Flag ACCEPTED, file byte-identical 1,973,328 B (probe re-link sha 9b3755ff vs deterministic baseline 9303d3e2), __eh_frame present unchanged — no-op as expected (eh_frame labels are already-stripped local symbols; the 36,432 B FDE content is intrinsic unwinding data). Restored via cargo build --release: sha 9303d3e2 (deterministic), 1,973,328 B, 1928 KB, binary runs exit 0, checks exit 0. The ld64 flag space is now 100% closed (every documented size-relevant flag A/B-verified or rejected/unavailable). binary_kb floor 1928 KB intact. No code change kept.","timestamp":1788190820236,"segment":1,"confidence":109,"asi":{"hypothesis":"Probe the literal last untested ld64 linker flag: -Wl,-no_eh_labels (controls label-symbol generation for __eh_frame FDEs). Expected no-op — eh_frame labels are local symbols already removed by strip='symbols', and the FDE content itself is required for async unwinding — but it was the only remaining ld64 flag never A/B'd in 99 experiments.","result":"NO-OP, as expected. Flag ACCEPTED (ld did not reject), file byte-identical 1,973,328 B (sha 9b3755ff for the probe re-link vs deterministic baseline 9303d3e2), __eh_frame section present unchanged. The eh_frame labels were already stripped local symbols; the FDE content (36,432 B) is intrinsic unwinding data. Restored via cargo build --release: sha 9303d3e2 (deterministic), 1,973,328 B, 1928 KB, binary runs exit 0, checks exit 0. The ld64 flag space is now 100% closed: every documented size-relevant flag A/B-verified (no_eh_labels this, no_function_starts #54, no_compact_unwind #59, no_exported_symbols #52, no_fixup_chains #81, dead_strip #18/#77, segalign #60, headerpad #68, no_pie #31, no_implicit_dylibs #62, no_weak_imports #65, dead_strip_dylibs #65, bind_at_load #69, no_adhoc_codesign #38, ld_classic #82, no_eh_frame/no_lazy_bind rejected #72/#69).","next_action_hint":"binary_kb floor 1928 KB intact. 100 experiments; every dimension AND every individual flag/flag-corner is now closed with evidence: profile, Rust LLVM passes, C-LTO passes, CFLAGS (incl. unroll/vectorize), linker flags (complete set), features, structure, sections, segments, padding, binding, fixups, signature, imports, load commands. The binary is exhaustively byte-accounted with zero removable content and zero removable padding. Only user-decision paths remain: crash-diagnostics flags (1896 KB), reqwest fork (TLS 1.2 ~1892-1896 / platform-verifier ~1920-1924), build-std (network). Recommend ending the loop; no in-scope non-behavior-changing hypothesis exists."}}
{"run":101,"commit":"98feb83","metric":1928,"metrics":{"build_seconds":15.9},"status":"discard","description":"Read-only diagnostic (discard — no metric change): the one instruction class never censused in 100 experiments — BTI (Branch Target Identification). Full 331,833-instruction disassembly census: bti 0 (Apple Silicon/Mach-O does not use BTI — no per-function bti overhead to remove), PAC 0 (re-confirms #89), brk 162 (648 B panic=abort trap points, intrinsic), nop 3,138 (12,552 B, matches #89 exactly — adr;nop pairs render as separate lines in this objdump but are the same intrinsic blind-reference form). The instruction-level dimension is now fully closed alongside NOPs (#89) and atomics (#88): zero removable instruction-level overhead. No code change, no rebuild; floor 1928 KB (1,973,328 B, sha 9303d3e2) intact, binary runs, checks green.","timestamp":1788190907176,"segment":1,"confidence":109,"asi":{"hypothesis":"The one instruction class never censused in 100 experiments: BTI (Branch Target Identification) on aarch64. If LLVM emits 'bti c' at function entries (~10,290 functions x 4 B = up to ~41 KB), disabling -C target-feature=-bti could be a large lever. Also re-verified PAC (0, per #89) and enumerated panic=abort trap points.","result":"CLOSED — BTI is absent (0 bti instructions across the full 331,833-instruction disassembly), confirming Apple Silicon/Mach-O does not use BTI and there is no per-function bti overhead to remove. Full instruction census: bti 0, PAC 0 (re-confirms #89), brk 162 (648 B — the panic=abort trap points, intrinsic: removing them would break abort semantics), nop 3,138 (12,552 B, matches #89 exactly; the adr;nop pairs render as separate lines in this objdump but are the same intrinsic blind-reference form). The instruction-level dimension is now fully closed alongside NOPs (#89) and atomics (#88): zero removable instruction-level overhead exists. Read-only diagnostic, no code change, no rebuild. Floor 1928 KB (1,973,328 B, sha 9303d3e2) intact, binary runs, checks green.","next_action_hint":"binary_kb floor 1928 KB intact. 101 experiments; every dimension AND every sub-corner (instruction-level: NOP/PAC/BTI/atomics/brk) now closed with evidence. The binary is exhaustively byte-accounted. Zero in-scope non-behavior-changing hypotheses remain. Only user-decision paths: crash-diagnostics flags (1896 KB), reqwest fork (TLS 1.2 ~1892-1896 / platform-verifier ~1920-1924), build-std (network)."}}
